Extract Date,Status,Task Link,Origin URL,Title,Location,Price,Tag,ID,Area,Bedrooms,Bathrooms,Energy Class,Description,Agent Name,Main Image,Image1,Image2,Image3,Image4,Image5,Image6,Image7,Image8,Image9,Image10,Image11,Image12,Image13,Image14,Image15,Image16,Image17,Image18,Image19,Image20,Image21,Image22,Image23,Image24
2025-12-20 03:11:42,Successful,https://dashboard.browse.ai/workspaces/miguel-pinto/robots/bc1be172-8182-411a-a043-eb327d30c661/history/019b39bd-b8c0-731f-9fcb-d412bdaaa026,https://remax.pt/pt/imoveis/venda-moradia-t4-palmela-quinta-do-anjo/120992654-460,Moradia T4 em Palmela com carregamento de carros elétricos,Quinta do Anjo,663 000 €,Venda,id. 120992654-460,342 m²,4 Quartos,3 WC,A,"Moradia T4 | Nova | Quinta da Bela Vista

Apresento esta exclusiva moradia T4 em construção, situada na tranquila e aprazível localidade da Quinta do Anjo, uma zona cada vez mais valorizada pela sua proximidade a Palmela, à Serra da Arrábida e ao fácil acesso às principais vias de ligação a Lisboa e Setúbal.

Com uma arquitetura moderna e linhas elegantes, esta moradia está inserida num generoso lote de terreno, oferecendo todas as comodidades para uma vida confortável, segura e de elevada qualidade.

Características Principais:
Tipologia: T4 (4 quartos)

Estado: Em construção

Localização: Quinta do Anjo, Palmela

Estacionamento privativo: Para 2 viaturas

Piscina privada

Jardim com zona de lazer

Design contemporâneo

Materiais e acabamentos de alta qualidade


Distribuição do Imóvel:
Ao entrar nesta moradia, é impossível não notar a ampla luminosidade natural que percorre toda a casa. As janelas de grandes dimensões e a disposição estratégica dos espaços permitem uma sensação de leveza e fluidez, elevando o conforto diário.

Sala de estar e jantar espaçosa: Ideal para receber visitas e desfrutar de momentos em família, com acesso direto ao jardim e à piscina.

Cozinha moderna e funcional: Com design atual e possibilidade de personalização nos acabamentos.

4 Quartos de excelentes dimensões: Incluindo uma suíte principal com casa de banho privativa e espaço para closet.

Casas de banho modernas e bem equipadas: Com materiais selecionados para garantir conforto e durabilidade.

Zona exterior com jardim: Perfeita para lazer, refeições ao ar livre e atividades em família.

Piscina privativa: Um verdadeiro luxo para os dias de calor, com espaço envolvente para espreguiçadeiras ou lounge.


Outras Vantagens:
Pré-instalação de ar condicionado

Estores elétricos

Vidros duplos e isolamento térmico/acústico

Painéis solares 

Possibilidade de escolha de alguns acabamentos durante a fase de construção

Zona tranquila, com vistas desafogadas e excelente exposição solar


Localização Privilegiada:
A Quinta do Anjo oferece o equilíbrio perfeito entre tranquilidade rural e proximidade urbana. Com fáceis acessos a:

Palmela e Setúbal

Autoestrada A2 (Lisboa/Algarve)

Estações de comboio (Fertagus)

Escolas, comércio local, serviços e zonas verdes

A poucos minutos da Serra da Arrábida e das praias da região

Venha visitar.",Diogo Maia,https://i.maxwork.pt/l-feat/listings/12099/7003128/6a4e5e0f-956d-4804-9bfb-3586e70e04c4.jpg,https://i.maxwork.pt/ds-l/listings/12099/7003128/6443e38a-38f6-4010-a894-18af5a0cc95a.jpg,https://i.maxwork.pt/ds-l/listings/12099/7003128/fa3808ec-f1a0-4aed-bddb-55020f74bb1a.jpg,https://i.maxwork.pt/ds-l/listings/12099/7003128/b02ee237-a443-4c49-9be2-7e672cb79a90.jpg,,,,,,,,,,,,,,,,,,,,,
2025-12-20 03:07:38,Successful,https://dashboard.browse.ai/workspaces/miguel-pinto/robots/bc1be172-8182-411a-a043-eb327d30c661/history/019b39b9-a7cf-77bf-a796-60b61782bb6d,https://remax.pt/pt/imoveis/venda-apartamento-t3-montijo-montijo-e-afonsoeiro/120992654-444,Apartamento T3 em Montijo com elevador,Montijo e Afonsoeiro,380 000 €,Venda,id. 120992654-444,127 m²,3 Quartos,2 WC,A,"T3 Novo | Exclusivo no Centro do Montijo

Cedência de posição contratual

Entrega prevista: Início de 2026

Descubra o privilégio de viver com elegância, luz e espaço. Oportunidade única de adquirir um T3 novo, com características exclusivas e localização privilegiada no coração do Montijo.

Situado no 2.º andar, este imóvel oferece:

• 127 m² de área total bruta privativa

• 1 lugar de garagem incluído

Com arquitetura contemporânea e excelente exposição solar, este apartamento foi desenhado para quem valoriza conforto, funcionalidade e versatilidade.

Viva Mais. Viva Melhor.

Destaques que fazem a diferença:

• Acabamentos modernos e de qualidade: Materiais duradouros e esteticamente elegantes.

• Distribuição inteligente: Zonas sociais amplas e bem separadas da área privada.

• Garagem: 1 lugar de estacionamento incluído.

Localização Premium: Montijo: um novo centro com alma e futuro

No centro do Montijo, perto de escolas, comércio, serviços e transportes.

A poucos minutos de Lisboa, com acesso rápido à Ponte Vasco da Gama e principais vias.

Uma zona em crescimento, com forte valorização e excelente qualidade de vida. 

Ideal para:

• Habitação Própria:

Quem procura um lar moderno, bem localizado e com espaços exteriores privados. 

• Investimento Inteligente:

Investidores à procura de um imóvel com yields atrativas e potencial de valorização garantido. 

Mais do que um apartamento — é um novo começo.

Entre em contacto para mais informações e agende a sua visita!",Diogo Maia,https://i.maxwork.pt/l-feat/listings/12099/6992046/442e3794-2baa-430b-8b58-f2aa63235ec3.jpg,https://i.maxwork.pt/ds-l/listings/12099/6992046/9c234293-9e4f-4653-9446-cb923e819f35.jpg,https://i.maxwork.pt/ds-l/listings/12099/6992046/e9e7b41d-1192-49d5-a7ca-e9af357b1ed4.jpg,https://i.maxwork.pt/ds-l/listings/12099/6992046/bf033e1d-3def-4f96-be40-61d8747ade2f.jpg,https://i.maxwork.pt/ds-l/listings/12099/6992046/972bc483-a350-4656-a44e-fac61db4c20c.jpg,https://i.maxwork.pt/ds-l/listings/12099/6992046/4b27fb77-e5e8-4940-bf11-9c09d285a9f3.jpg,https://i.maxwork.pt/ds-l/listings/12099/6992046/ae8ccb39-95d2-4274-8f10-4c66f0837bea.jpg,https://i.maxwork.pt/ds-l/listings/12099/6992046/70145e7a-ba2e-4afa-8ccd-d6b58ec6a218.jpg,https://i.maxwork.pt/ds-l/listings/12099/6992046/717e1f11-dbcd-4d7e-9e17-9e7a6a3bb19b.jpg,https://i.maxwork.pt/ds-l/listings/12099/6992046/e154d134-70fb-40d9-978d-bc5cd1b057e8.jpg,,,,,,,,,,,,,,,
2025-12-20 03:07:37,Successful,https://dashboard.browse.ai/workspaces/miguel-pinto/robots/bc1be172-8182-411a-a043-eb327d30c661/history/019b39b9-a7cf-74ac-9ab9-854886c32faa,https://remax.pt/pt/imoveis/venda-moradia-t4-lisboa-campolide/120992654-387,Moradia T4 em Lisboa com 1 lugar de garagem,Campolide,1 499 000 €,Venda,id. 120992654-387,227 m²,4 Quartos,4 WC,C,"Moradia T4 | Remodelada | Campolide

Esta moderna e espaçosa moradia geminada T3 + 1 foi totalmente remodelada, incluindo uma renovação completa da canalização e eletricidade. Com uma localização privilegiada em Campolide, junto ao icónico Aqueduto das Águas Livres, a propriedade ocupa um terreno de 244m² e é ideal para famílias que procuram conforto, qualidade e proximidade de tudo o que Lisboa tem para oferecer. A moradia é distribuída por três pisos e conta com acabamentos de elevada qualidade, proporcionando um ambiente sofisticado e funcional.

Características Principais:
Tipologia: T3 + 1 (três suítes e um espaço adicional que pode ser utilizado como escritório ou arrumos)
Área total do terreno: 244m²
Área bruta de construção: ampla e bem distribuída ao longo de três pisos.
Distribuição dos Pisos: Piso -1:

No piso inferior, a moradia conta com duas zonas de arrumos espaçosas, que oferecem grande flexibilidade de utilização. Estas divisões podem ser transformadas em escritório, atelier, zona de lazer, ou simplesmente mantidas como áreas de armazenamento, dependendo das necessidades do novo proprietário.

Zonas de arrumos/ escritório: O espaço é amplo e com grande potencial, perfeito para quem precisa de um local calmo para trabalhar.
Rés do Chão:

O piso térreo é a verdadeira área de convivência da casa, com uma ampla e luminosa sala de estar e jantar (46m²) em open space, permitindo total interação entre os espaços. Este ambiente versátil e moderno pode ser facilmente dividido em zonas distintas, criando áreas de estar e de jantar mais íntimas.

Sala de estar/jantar (46m²): Ampla e com muita luz natural, este espaço é ideal para momentos em família e para receber convidados.

Cozinha equipada: Totalmente equipada com eletrodomésticos da marca BOSCH, oferecendo um design contemporâneo e funcional. A cozinha também tem uma despensa para maior organização.

WC social: Completamente renovado e moderno, ideal para visitas.

Acesso ao terraço (30m²): A partir da sala, tem acesso direto a um generoso terraço de 30m², perfeito para aproveitar os dias de sol e realizar momentos de lazer ao ar livre em família ou com amigos. O terraço oferece privacidade e uma excelente área exterior para relaxamento.

Garagem: Situada no rés do chão, a garagem tem espaço para uma viatura, garantindo comodidade e segurança para o seu carro.

Piso Superior:

No andar superior, a moradia dispõe de três suítes, todas equipadas com closet, proporcionando uma organização e conforto excepcionais. Cada suíte tem acesso a terraço privado (24m²), com uma varanda adicional que permite desfrutar da vista e do ambiente tranquilo. O design deste piso garante total privacidade para os moradores.

Três suítes com closet: Todas as suítes são espaçosas, com armários embutidos de qualidade e com acesso direto ao terraço.
WC das suítes com janela: Cada suíte tem o seu próprio banheiro, totalmente remodelado, e com janela para garantir ventilação natural e luz.
Acesso ao sótão (20m²): Além das suítes, o piso superior conta com um sótão de 20m², ideal para ser usado como espaço de arrumos ou para outras funções, conforme a necessidade do proprietário.
Exterior:
Anexo (30m²): Na parte exterior da propriedade, encontra um anexo de 30m², que pode ser utilizado de diversas formas, como uma dependência extra, estúdio, ou zona de apoio ao jardim. O anexo inclui ainda um WC completo, oferecendo mais funcionalidade ao espaço.
Jardim: A propriedade conta com um jardim privado que envolve a moradia, oferecendo um ambiente tranquilo e acolhedor, perfeito para lazer e descontração ao ar livre.
Remodelação e Acabamentos:

A moradia foi totalmente remodelada com materiais de alta qualidade, cuidando de cada detalhe para garantir o conforto e a eficiência energética.

Isolamento térmico e acústico: A casa foi revestida com capoto, uma solução eficiente para isolamento térmico e acústico, proporcionando maior conforto e menor consumo energético.
Canalização e eletricidade renovadas: Toda a infraestrutura de canalização e eletricidade foi renovada, assegurando que a moradia esteja preparada para os padrões modernos de eficiência e segurança.
Localização:

A moradia está situada em Campolide, uma das zonas mais centrais e procuradas de Lisboa, com excelente acesso a transportes públicos, comércio e serviços.

Proximidade com pontos de interesse:
Aqueduto das Águas Livres, um dos marcos históricos mais emblemáticos da cidade.
Amoreiras, centro comercial e área residencial muito procurada.
Liceu Francês.
A poucos minutos da zona do Bairro Alto, Avenida da Liberdade e Príncipe Real.
Transportes públicos: Fácil acesso a várias linhas de metro e autocarros, com estações próximas para deslocações rápidas pela cidade.
Acessos rodoviários: Excelente proximidade com o Eixo Norte-Sul, A5, Radial de Benfica e a 2ª Circular, facilitando o acesso a outras áreas da cidade e aos principais centros de negócios.
Conclusão:

Esta moradia geminada T3 + 1 oferece uma combinação rara de conforto, funcionalidade, e qualidade de vida, com amplos espaços interiores, acabamentos modernos e uma localização privilegiada em Lisboa. É a escolha perfeita para quem busca uma casa com boas áreas, conforto e fácil acesso a todos os serviços e comodidades que a cidade oferece.

Agende a sua visita e venha conhecer pessoalmente este excelente imóvel!",Diogo Maia,https://i.maxwork.pt/l-feat/listings/12099/6929713/739edb3d-28da-40a1-9e15-a425bccc7186.jpg,https://i.maxwork.pt/ds-l/listings/12099/6929713/e5e033b6-5da1-4175-8795-c0b39e69df2a.jpg,https://i.maxwork.pt/ds-l/listings/12099/6929713/a54c556b-d6e6-4d36-9a51-0c33ec232c1c.jpg,https://i.maxwork.pt/ds-l/listings/12099/6929713/b8fee5af-b711-42c7-91f0-214636f50cc7.jpg,https://i.maxwork.pt/ds-l/listings/12099/6929713/d239b747-03c4-4333-8d8b-9ea16d590bf5.jpg,https://i.maxwork.pt/ds-l/listings/12099/6929713/20f07e5c-ba78-4e7e-892b-4b3858fd3c59.jpg,https://i.maxwork.pt/ds-l/listings/12099/6929713/62bbf724-ba68-4156-bc2b-2a260d1aa3c0.jpg,https://i.maxwork.pt/ds-l/listings/12099/6929713/9b5e7317-67ca-4127-b6ea-67699ceed066.jpg,https://i.maxwork.pt/ds-l/listings/12099/6929713/1d897c52-2ff1-4138-980e-53153593ff70.jpg,https://i.maxwork.pt/ds-l/listings/12099/6929713/859f556f-72ec-4e23-a1cf-a8fcfc6117a0.jpg,https://i.maxwork.pt/ds-l/listings/12099/6929713/9c3affe0-1d4d-4351-9f02-f6d2e10b8f7b.jpg,https://i.maxwork.pt/ds-l/listings/12099/6929713/43f70873-4e5f-4e13-8bc7-02d19d3bd29e.jpg,https://i.maxwork.pt/ds-l/listings/12099/6929713/9ea4bd07-a6d3-4ebf-ae11-afb7eb68c81c.jpg,https://i.maxwork.pt/ds-l/listings/12099/6929713/fc4fc616-5b54-4531-b998-63289af78e09.jpg,https://i.maxwork.pt/ds-l/listings/12099/6929713/21c95bab-8190-459f-b2a0-a4b985fc5874.jpg,https://i.maxwork.pt/ds-l/listings/12099/6929713/c698234b-db8a-4070-a475-b530f8588a49.jpg,https://i.maxwork.pt/ds-l/listings/12099/6929713/25c18f6e-58cc-40eb-8de5-ec6d116f1ed5.jpg,https://i.maxwork.pt/ds-l/listings/12099/6929713/a83f3c19-ed75-413f-8d59-a6c89ce47ddf.jpg,https://i.maxwork.pt/ds-l/listings/12099/6929713/d241e4f1-f8ab-4006-a887-649cd49e399d.jpg,https://i.maxwork.pt/ds-l/listings/12099/6929713/d54e4cc5-8798-4c7e-b294-5e9ef9fcbbb4.jpg,https://i.maxwork.pt/ds-l/listings/12099/6929713/9e19b383-15ed-4a56-9a8f-bc91e0c2b75f.jpg,https://i.maxwork.pt/ds-l/listings/12099/6929713/8bb95032-3665-45ee-b4c8-ab72bd13fc77.jpg,https://i.maxwork.pt/ds-l/listings/12099/6929713/14b53b99-dd05-4316-b191-6804db643c01.jpg,https://i.maxwork.pt/ds-l/listings/12099/6929713/69976e81-dae6-4c40-a6dc-a5a55c3b2a10.jpg,https://i.maxwork.pt/ds-l/listings/12099/6929713/7f53b38d-7fc3-4c73-b609-91518058e1f3.jpg
2025-12-20 03:07:37,Successful,https://dashboard.browse.ai/workspaces/miguel-pinto/robots/bc1be172-8182-411a-a043-eb327d30c661/history/019b39b9-a7cf-7d8e-ae65-34dc84fd3a22,https://remax.pt/pt/imoveis/venda-apartamento-t2-montijo-montijo-e-afonsoeiro/120992654-442,Apartamento T2 em Montijo com elevador,Montijo e Afonsoeiro,415 000 €,Venda,id. 120992654-442,94 m²,2 Quartos,2 WC,NC,"T2+1 Duplex Novo | Centro do Montijo

Cedência de posição contratual - Pronto a escriturar e com entrega no início de 2026

Descubra o privilégio de viver com elegância, luz e espaço no coração do Montijo.

Características Principais

•⁠ ⁠133 m² de área bruta privativa

•⁠ ⁠20 m² de sótão com luz natural e acesso interior

•⁠ ⁠15 m² de terraço privativo

•⁠ ⁠1 lugar de garagem incluído

•⁠ ⁠Varanda com vista sobre o Montijo e o Castelo de Palmela

•⁠ ⁠Arquitetura moderna e excelente exposição solar

Destaques que fazem a diferença

•⁠ ⁠Piso superior multifuncional com pré-instalação de casa de banho — ideal para terceiro quarto, escritório ou sala de lazer

•⁠ ⁠Acesso autónomo e direto ao sótão por elevador

•⁠ ⁠Terraço e varanda privativos

•⁠ ⁠Garagem para maior comodidade e segurança

Localização Premium – Centro do Montijo

A poucos minutos da Ponte Vasco da Gama e com acesso facilitado a Lisboa, este imóvel está rodeado de tudo o que precisa: escolas, comércio, serviços e transportes.

Ideal para:

Quem procura uma casa com boas áreas, construção nova, luminosa e com espaços exteriores

Investidores à procura de rentabilidade (yield estimada de 5%) numa zona em expansão

Mais do que um apartamento — é um novo começo.

Entre em contacto para mais informações e agende já a sua visita!",Diogo Maia,https://i.maxwork.pt/l-feat/listings/12099/6991816/078330e7-6cae-4464-85cd-c0d1832dbefc.jpg,https://i.maxwork.pt/ds-l/listings/12099/6991816/fbc5ec80-f7b6-491b-bf40-6d589b828f06.jpg,https://i.maxwork.pt/ds-l/listings/12099/6991816/c3b9fc46-796d-4d4f-ba1d-404d0295efad.jpg,https://i.maxwork.pt/ds-l/listings/12099/6991816/69199d2f-e255-4184-a262-07be2ff289d1.jpg,https://i.maxwork.pt/ds-l/listings/12099/6991816/46372886-eb33-4ae3-abb3-3ae64f4569b7.jpg,https://i.maxwork.pt/ds-l/listings/12099/6991816/016d9151-19fa-444f-b1fd-01bdcfeacb6f.jpg,https://i.maxwork.pt/ds-l/listings/12099/6991816/7d69ed2f-6d50-4e50-bdf0-8457283f9df4.jpg,https://i.maxwork.pt/ds-l/listings/12099/6991816/4c7402bf-f1f8-40fb-a22d-68ed9acbc68f.jpg,https://i.maxwork.pt/ds-l/listings/12099/6991816/88828d07-66ec-4b26-92e4-77e4a3e061ed.jpg,https://i.maxwork.pt/ds-l/listings/12099/6991816/361b6ac2-64b7-4858-8e2a-0326c4f56ce4.jpg,https://i.maxwork.pt/ds-l/listings/12099/6991816/80c1b096-b172-4d89-abd2-bbf7d17e65bd.jpg,https://i.maxwork.pt/ds-l/listings/12099/6991816/25965204-f1e5-4c13-95bb-79093a215111.jpg,https://i.maxwork.pt/ds-l/listings/12099/6991816/0146b1d8-4e9c-40cd-b90c-8273b0dfe189.jpg,,,,,,,,,,,,
2025-12-20 03:07:36,Successful,https://dashboard.browse.ai/workspaces/miguel-pinto/robots/bc1be172-8182-411a-a043-eb327d30c661/history/019b39b9-a7cf-7c4c-a719-b11c87da1d24,https://remax.pt/pt/imoveis/venda-moradia-t5-palmela-quinta-do-anjo/120992654-441,Moradia T5 em Palmela com 2 lugares de garagem,Quinta do Anjo,780 000 €,Venda,id. 120992654-441,199 m²,5 Quartos,3 WC,B-,"Moradia | 5 Quartos | Piscina | Quinta do Anjo

Magnífica moradia unifamiliar localizada na charmosa e sossegada zona da Quinta do Anjo, perfeita para quem procura conforto, espaço e qualidade de vida. Implantada num generoso lote de 600m², esta propriedade destaca-se pela sua excelente organização interior, espaços exteriores bem cuidados e uma piscina privativa ideal para os dias mais quentes. Distribuição da Moradia:

Rés-do-Chão:

Cozinha totalmente equipada, com eletrodomésticos modernos e bastante arrumação, pensada para quem valoriza funcionalidade e praticidade no dia a dia;

Despensa de apoio à cozinha, ideal para armazenamento adicional;

Casa de banho completa, com acabamentos de qualidade;

Dois quartos espaçosos, ideais como quartos de hóspedes, escritório ou para crianças, com boa luminosidade natural e áreas generosas.

Primeiro Andar:

Três quartos, todos com excelente luminosidade, boas áreas e potencial para suíte, quarto principal e quartos secundários;

Duas casas de banho completas;

Duas varandas amplas, com vistas desafogadas, perfeitas para desfrutar de momentos de tranquilidade, leitura ou convívio. Exterior:

Garagem fechada, com espaço para viatura e arrumação adicional;

Espaço de jardim ajardinado e muito bem cuidado, ideal para quem gosta de espaços verdes e momentos ao ar livre;

Piscina privada, inserida harmoniosamente no espaço exterior, proporcionando lazer e entretenimento para toda a família;

Zona de terraço ou esplanada, ideal para refeições no exterior, churrascos ou simplesmente relaxar ao final do dia.Outros Destaques:

Boas acessibilidades e ligação rápida às principais vias de comunicação;

Zona calma, segura e residencial, com proximidade a escolas, comércio, serviços e transportes;

Excelente exposição solar e privacidade.

 Uma oportunidade única para viver com qualidade, em harmonia com a natureza, sem abdicar da proximidade à cidade.

Entre em contacto para agendar a sua visita e venha conhecer pessoalmente o potencial desta casa!",Diogo Maia,https://i.maxwork.pt/l-feat/listings/12099/6980541/4bb96994-5a56-4166-bb96-e57d835626c4.jpg,https://i.maxwork.pt/ds-l/listings/12099/6980541/378de2d3-772c-4fd6-a658-28a7cd8a7872.jpg,https://i.maxwork.pt/ds-l/listings/12099/6980541/2b44ee22-c34a-4ada-b150-b8982d341a48.jpg,https://i.maxwork.pt/ds-l/listings/12099/6980541/da964b51-94ef-49d5-9b9c-df3c7ea7c329.jpg,https://i.maxwork.pt/ds-l/listings/12099/6980541/21e05b98-b086-46f0-8382-93ef2dca7655.jpg,https://i.maxwork.pt/ds-l/listings/12099/6980541/3ebe3ee3-7b17-4740-a43f-3d86184a5fa9.jpg,https://i.maxwork.pt/ds-l/listings/12099/6980541/12361974-a5e6-4036-9e42-9c36ae9ef65b.jpg,https://i.maxwork.pt/ds-l/listings/12099/6980541/e585b1f9-4c11-4095-b56e-5c0ba208c17f.jpg,https://i.maxwork.pt/ds-l/listings/12099/6980541/57c6c8d0-8366-4f78-ba6d-65ac4a93491e.jpg,https://i.maxwork.pt/ds-l/listings/12099/6980541/14f6035f-bfd5-4459-943c-caf7e7b3a217.jpg,https://i.maxwork.pt/ds-l/listings/12099/6980541/586803c4-de45-4cf6-83d6-fc3d455abfe3.jpg,https://i.maxwork.pt/ds-l/listings/12099/6980541/6f9d4f6c-c8ca-4321-a03a-6e046608f3ea.jpg,https://i.maxwork.pt/ds-l/listings/12099/6980541/4e612979-2cba-4fd1-bc6d-302b49a3c99f.jpg,https://i.maxwork.pt/ds-l/listings/12099/6980541/2708bc1e-3d34-4dce-b673-c0843f842a6b.jpg,https://i.maxwork.pt/ds-l/listings/12099/6980541/08cb63e8-f90e-47de-a1e3-f24a5bb4810b.jpg,https://i.maxwork.pt/ds-l/listings/12099/6980541/80e79d61-de64-45cb-8747-7b5bdeee61ed.jpg,https://i.maxwork.pt/ds-l/listings/12099/6980541/372c02c2-8cc1-4467-9118-d8775e9d0339.jpg,https://i.maxwork.pt/ds-l/listings/12099/6980541/9ceb00d4-a8ac-4c15-86dd-100a9e5a0596.jpg,https://i.maxwork.pt/ds-l/listings/12099/6980541/fd0271a7-eed1-48a6-83e6-d1b21f78f0e2.jpg,https://i.maxwork.pt/ds-l/listings/12099/6980541/700d4b64-3dfb-48f0-b50b-6ee75b46a3e6.jpg,https://i.maxwork.pt/ds-l/listings/12099/6980541/3379196e-1a4c-4c01-b175-0083d0107379.jpg,https://i.maxwork.pt/ds-l/listings/12099/6980541/692cc967-ec5e-4b03-ac96-3683014fcaf6.jpg,https://i.maxwork.pt/ds-l/listings/12099/6980541/57957b18-8956-42bd-bc58-db00c938985c.jpg,https://i.maxwork.pt/ds-l/listings/12099/6980541/f50d570b-04e5-4f68-8f09-bfe4cfb402e8.jpg,https://i.maxwork.pt/ds-l/listings/12099/6980541/372fcc47-ab82-48e7-85e3-d77e3e69355f.jpg
2025-12-20 03:07:36,Successful,https://dashboard.browse.ai/workspaces/miguel-pinto/robots/bc1be172-8182-411a-a043-eb327d30c661/history/019b39b9-a7cf-7d03-b8fc-390a360cca45,https://remax.pt/pt/imoveis/venda-moradia-t4-palmela-quinta-do-anjo/120992654-462,Moradia T4 em Palmela com carregamento de carros elétricos,Quinta do Anjo,693 000 €,Venda,id. 120992654-462,346 m²,4 Quartos,3 WC,A+,"Moradia T4 | Nova | Quinta da Bela Vista

Apresento esta exclusiva moradia T4 em construção, situada na tranquila e aprazível localidade da Quinta do Anjo, uma zona cada vez mais valorizada pela sua proximidade a Palmela, à Serra da Arrábida e ao fácil acesso às principais vias de ligação a Lisboa e Setúbal.

Com uma arquitetura moderna e linhas elegantes, esta moradia está inserida num generoso lote de terreno, oferecendo todas as comodidades para uma vida confortável, segura e de elevada qualidade.

Características Principais:
Tipologia: T4 (4 quartos)

Estado: Em construção

Localização: Quinta do Anjo, Palmela

Estacionamento privativo: Para 2 viaturas

Piscina privada

Jardim com zona de lazer

Design contemporâneo

Materiais e acabamentos de alta qualidade


Distribuição do Imóvel:
Ao entrar nesta moradia, é impossível não notar a ampla luminosidade natural que percorre toda a casa. As janelas de grandes dimensões e a disposição estratégica dos espaços permitem uma sensação de leveza e fluidez, elevando o conforto diário.

Sala de estar e jantar espaçosa: Ideal para receber visitas e desfrutar de momentos em família, com acesso direto ao jardim e à piscina.

Cozinha moderna e funcional: Com design atual e possibilidade de personalização nos acabamentos.

4 Quartos de excelentes dimensões: Incluindo uma suíte principal com casa de banho privativa e espaço para closet.

Casas de banho modernas e bem equipadas: Com materiais selecionados para garantir conforto e durabilidade.

Zona exterior com jardim: Perfeita para lazer, refeições ao ar livre e atividades em família.

Piscina privativa: Um verdadeiro luxo para os dias de calor, com espaço envolvente para espreguiçadeiras ou lounge.


Outras Vantagens:
Pré-instalação de ar condicionado

Estores elétricos

Vidros duplos e isolamento térmico/acústico

Painéis solares 

Possibilidade de escolha de alguns acabamentos durante a fase de construção

Zona tranquila, com vistas desafogadas e excelente exposição solar


Localização Privilegiada:
A Quinta do Anjo oferece o equilíbrio perfeito entre tranquilidade rural e proximidade urbana. Com fáceis acessos a:

Palmela e Setúbal

Autoestrada A2 (Lisboa/Algarve)

Estações de comboio (Fertagus)

Escolas, comércio local, serviços e zonas verdes

A poucos minutos da Serra da Arrábida e das praias da região

Venha visitar.",Diogo Maia,https://i.maxwork.pt/l-feat/listings/12099/7003131/0ff8e9ed-876e-436d-b4a4-75b3072c478e.jpg,https://i.maxwork.pt/ds-l/listings/12099/7003131/29427edf-3030-4bdb-9206-9a2d4fb73d53.jpg,https://i.maxwork.pt/ds-l/listings/12099/7003131/ab1e53d5-287e-40e6-befc-778d6bad3c7d.jpg,https://i.maxwork.pt/ds-l/listings/12099/7003131/41b60b81-6a98-49ae-b8a5-4386d7068762.jpg,,,,,,,,,,,,,,,,,,,,,
