Extract Date,Status,Task Link,Origin URL,Title,Location,Price,Tag,ID,Area,Bedrooms,Bathrooms,Energy Class,Description,Agent Name,Main Image,Image1,Image2,Image3,Image4,Image5,Image6,Image7,Image8,Image9,Image10,Image11,Image12,Image13,Image14,Image15,Image16,Image17,Image18,Image19,Image20,Image21,Image22,Image23,Image24
2025-12-20 03:07:27,Successful,https://dashboard.browse.ai/workspaces/miguel-pinto/robots/bc1be172-8182-411a-a043-eb327d30c661/history/019b39b9-a7cd-7cfd-ba06-c31954086110,https://remax.pt/pt/imoveis/venda-apartamento-t2-matosinhos-matosinhos-e-leca-da-palmeira/120992654-507,Apartamento T2 em Matosinhos com 1 lugar de garagem,Matosinhos e Leça da Palmeira,440 000 €,Venda,id. 120992654-507,68 m²,2 Quartos,2 WC,A+,"SUL 560 | Matosinhos Sul

Uma nova forma de viver entre o mar e a cidade

O SUL 560 é um empreendimento residencial de excelência, concebido para oferecer uma experiência de vida que alia sofisticação, funcionalidade e proximidade ao mar, no centro de uma das localizações mais valorizadas da Área Metropolitana do Porto: Matosinhos Sul.

Localização Privilegiada

Localizado na Rua Afonso Cordeiro,
o SUL 560 beneficia de uma posição estratégica, a poucos minutos a pé
da praia e com acesso direto à estação de metro. Esta localização única
proporciona um quotidiano equilibrado entre a tranquilidade do litoral e
a vibração urbana, com comércio local, restaurantes, escolas, serviços,
zonas verdes e equipamentos culturais nas imediações.

A proximidade ao Parque da Cidade do Porto e
ao Terminal de Cruzeiros reforça o potencial de valorização e a
atratividade para quem procura investir com inteligência ou viver com
qualidade.

Arquitetura e Design

Com uma estética contemporânea e linhas arquitetónicas elegantes, o SUL 560 distingue-se pelas suas fachadas sóbrias e modernas, que integram-se harmoniosamente na envolvente urbana.

Cada apartamento foi cuidadosamente projetado para maximizar o conforto e a luz natural, privilegiando a amplitude, a funcionalidade dos espaços e a ligação fluida entre interior e exterior. As varandas e terraços generosos prolongam a vivência das áreas sociais e proporcionam vistas desafogadas e momentos de lazer ao ar livre.

Os materiais e acabamentos
foram criteriosamente selecionados, obedecendo a elevados padrões de
qualidade e durabilidade, com soluções técnicas e estéticas que
valorizam o detalhe, o conforto térmico e acústico, e a eficiência
energética.

Composição do Empreendimento

22 Apartamentos distribuídos por tipologias T1, T2 e T3, adequados tanto para jovens profissionais como para famílias.

2 Espaços Comerciais no piso térreo, ideais para comércio de proximidade ou serviços.

Estacionamento privativo e zonas de arrumos para maior comodidade dos residentes.Interiores Pensados para Viver Melhor

Os apartamentos do SUL 560 apresentam plantações bem estruturadas, com zonas sociais amplas, cozinhas totalmente equipadas e quartos com roupeiros embutidos e, em muitas frações, suíte.

A atenção ao detalhe estende-se aos acabamentos:

Pavimentos flutuantes em madeira ou equivalente de alta resistência

Louças sanitárias suspensas e torneiras de design contemporâneo

Cozinhas com eletrodomésticos encastrados

Iluminação LED embutida

Pré-instalação de ar condicionado e soluções eficientes de isolamento térmico e acústico

Espaços Comuns que Elevam a Qualidade de Vida

O SUL 560 foi desenhado para ir além da
habitação convencional, oferecendo espaços comuns que acrescentam valor
real à experiência de viver aqui:

Ginásio com luz natural, exclusivo para os moradores, ideal para treinar com conforto e segurança

Áreas verdes comuns, pensadas como zonas de relaxamento, convívio e bem-estar

Hall de entrada com design contemporâneo, que reflete o cuidado estético do projeto desde o primeiro contacto

Para Viver ou Investir com Segurança

O SUL 560 representa uma oportunidade rara
de viver com qualidade num dos bairros mais cobiçados do Grande Porto. A
sua localização, aliada à qualidade da construção e ao cuidado na
conceção dos espaços, fazem deste projeto uma escolha segura, seja para residência própria, segunda habitação ou investimento para arrendamento.

Com a construção a cargo da CVM Construções,
empresa reconhecida pela sua competência técnica e solidez no mercado, o
projeto assegura elevados padrões de execução e fiabilidade.",Diogo Maia,https://i.maxwork.pt/l-feat/listings/12099/7028775/8539ec5b-3b27-449e-a772-eab04ac32148.jpg,https://i.maxwork.pt/ds-l/listings/12099/7028775/89b65aae-dbe9-461a-92a3-7fa92fe28ed3.jpg,https://i.maxwork.pt/ds-l/listings/12099/7028775/f07851f4-e8f3-4627-83fb-62e614db89bf.jpg,https://i.maxwork.pt/ds-l/listings/12099/7028775/01e8d38e-70c9-46c9-a524-d5e10e9ac7b0.jpg,https://i.maxwork.pt/ds-l/listings/12099/7028775/a4815d17-324e-4fa1-b983-ab88ebd79813.jpg,https://i.maxwork.pt/ds-l/listings/12099/7028775/0bad4f1a-4fb4-4fee-bcf7-05af0cafa9bb.jpg,https://i.maxwork.pt/ds-l/listings/12099/7028775/3ff98083-e4d6-48ba-8c62-0439fabda423.jpg,https://i.maxwork.pt/ds-l/listings/12099/7028775/463bb49f-1e87-45ae-beab-91af9cf70193.jpg,https://i.maxwork.pt/ds-l/listings/12099/7028775/55dae5f3-b1ff-4ccd-805d-95c54ade2daa.jpg,,,,,,,,,,,,,,,,
2025-12-20 03:07:27,Successful,https://dashboard.browse.ai/workspaces/miguel-pinto/robots/bc1be172-8182-411a-a043-eb327d30c661/history/019b39b9-a7cc-70c4-9d64-1353c8a96a62,https://remax.pt/pt/imoveis/venda-loja-tlisboa-avenidas-novas/120992654-512,Loja em Lisboa com 176 m²,Avenidas Novas,360 000 €,Venda,id. 120992654-512,176 m²,- -,2 WC,C,"Loja | Alvalade

Excelente oportunidade de investimento ou instalação de negócio no coração de Alvalade, uma das zonas mais procuradas de Lisboa, reconhecida pela sua dinâmica residencial, comercial e pela forte presença de serviços.

Situada na Rua Dr. Gama Barros, esta loja conta com 157m² de área bruta privativa, com um layout versátil e uma montra com boa visibilidade para a rua, ideal para captar a atenção de transeuntes e clientes.

Características do Imóvel:

Área total: 157 m²

Pé-direito generoso, proporcionando maior amplitude ao espaço

Montra ampla voltada para a rua, com excelente visibilidade e luz natural

Dois acessos independentes (entrada principal e entrada de serviço/logística)

Infraestruturas preparadas para restauração, incluindo:

Sistema de extração de fumos

Copa/cozinha técnica

Armazém ou área de stock

Instalações sanitárias para público e staff

Possibilidade de reorganização do espaço para adaptar a diferentes tipos de negócio

Potencial de Utilização

Embora tenha funcionado anteriormente como restaurante, este espaço pode ser facilmente convertido e adaptado a uma ampla variedade de atividades comerciais ou de serviços, tais como:

Loja de retalho

Clínica médica ou dentária

Ginásio ou estúdio de pilates/yoga

Escritório com atendimento ao público

Espaço de cowork ou formação

Showroom ou atelier

Localização

Inserido numa zona residencial consolidada, com elevada densidade populacional

Rua com bastante circulação pedonal e automóvel

A poucos minutos a pé da Avenida de Roma e do Metro de Alvalade

Excelente cobertura de transportes públicos (metro, autocarros)

Fácil acesso ao centro da cidade, ao aeroporto e principais vias de circulação (A1, Eixo Norte-Sul)

Benefícios Adicionais

Facilidade de estacionamento na zona (incluindo zonas de cargas e descargas)

Imóvel em regime de propriedade plena

Potencial de valorização na zona, em virtude da procura crescente por espaços comerciais em Alvalade

Este espaço é ideal para quem procura abrir ou expandir o seu negócio num dos bairros mais vibrantes e valorizados de Lisboa, com uma base de clientes fidelizada e com grande movimento diário.

Para mais informações, agendamento de visita ou para obter planta do imóvel, entre em contacto.",Diogo Maia,https://i.maxwork.pt/l-feat/listings/12099/7016667/26090481-eb23-4f44-a9d5-60eee6e45547.jpg,https://i.maxwork.pt/ds-l/listings/12099/7016667/7548b34a-4ad5-494b-9748-401d01f27f0d.jpg,https://i.maxwork.pt/ds-l/listings/12099/7016667/c8c564ee-b0c5-4c4d-9c1c-b74f4f447358.jpg,https://i.maxwork.pt/ds-l/listings/12099/7016667/1f6c65d6-5669-4bff-98d7-b5ac2be8f4e6.jpg,https://i.maxwork.pt/ds-l/listings/12099/7016667/31967a3f-f8e3-4b20-9c51-360f57dbd8d2.jpg,https://i.maxwork.pt/ds-l/listings/12099/7016667/549a57c2-83ed-4176-b43d-6258b111f41f.jpg,https://i.maxwork.pt/ds-l/listings/12099/7016667/47df5e11-43f2-4eef-ae1f-020c8e6f6cfe.jpg,https://i.maxwork.pt/ds-l/listings/12099/7016667/8f10e7ae-4c46-4901-bbde-6aa29bbd9ecf.jpg,https://i.maxwork.pt/ds-l/listings/12099/7016667/66f81860-ed8f-4b07-8f4f-0c1f46718fc7.jpg,https://i.maxwork.pt/ds-l/listings/12099/7016667/866ec768-43bc-4c8e-8a84-b7b8f55dbddc.jpg,https://i.maxwork.pt/ds-l/listings/12099/7016667/7ab58b21-3b0c-414e-8f5d-bc13446ba4c4.jpg,https://i.maxwork.pt/ds-l/listings/12099/7016667/42c2a767-a437-4c7a-8441-1b57876719c9.jpg,https://i.maxwork.pt/ds-l/listings/12099/7016667/6d3e6b95-80f7-4cf0-b1c1-e48cc6b5ec22.jpg,https://i.maxwork.pt/ds-l/listings/12099/7016667/86c0e72f-0e39-4881-b163-4330815007a3.jpg,https://i.maxwork.pt/ds-l/listings/12099/7016667/a69d537d-8b7a-4309-8750-08482ab3d3ea.jpg,https://i.maxwork.pt/ds-l/listings/12099/7016667/aaa8fc80-34ac-4d2a-9fe6-d3eaf47e4b1d.jpg,https://i.maxwork.pt/ds-l/listings/12099/7016667/b9fef608-e8d5-4e2f-a4b3-bedc15d5e902.jpg,https://i.maxwork.pt/ds-l/listings/12099/7016667/55e33491-47fc-49b6-89f6-a073cd89824d.jpg,https://i.maxwork.pt/ds-l/listings/12099/7016667/35fe1890-6492-436b-acc9-6146223091e6.jpg,https://i.maxwork.pt/ds-l/listings/12099/7016667/12eb337d-9337-40df-b951-c4b00230f222.jpg,,,,,
2025-12-20 03:07:27,Successful,https://dashboard.browse.ai/workspaces/miguel-pinto/robots/bc1be172-8182-411a-a043-eb327d30c661/history/019b39b9-a7ce-7348-84a4-7e516213683d,https://remax.pt/pt/imoveis/venda-apartamento-t2-matosinhos-matosinhos-e-leca-da-palmeira/120992654-494,Apartamento T2 em Matosinhos com 1 lugar de garagem,Matosinhos e Leça da Palmeira,555 000 €,Venda,id. 120992654-494,109 m²,2 Quartos,2 WC,A,"Edifício Sul 482 – Matosinhos Sul

Viver em Matosinhos Sul é ter todos os dias o privilégio de estar junto ao mar, rodeado por natureza e, ao mesmo tempo, com todas as comodidades da vida urbana. Aqui, a praia e o oceano tornam-se parte da rotina, o Parque da Cidade está a poucos minutos e o metro garante ligações rápidas e práticas ao centro do Porto e a toda a região. Um cenário perfeito para quem valoriza qualidade de vida, mobilidade e bem-estar.

O Sul 482 nasce desse conceito: oferecer não apenas apartamentos, mas um estilo de vida completo. O edifício foi concebido pela PFArchStudio, promovido pela CVM Investimentos e tem a execução a cargo da CVM Construções, reconhecida pela excelência dos seus projetos. Cada detalhe foi pensado para aliar design contemporâneo, funcionalidade e conforto, resultando num conjunto harmonioso e sofisticado.

Com apenas 10 frações exclusivas, o empreendimento garante privacidade e distinção. São 9 apartamentos de tipologias T1 e T2 e 1 espaço comercial, distribuídos por vários pisos. As áreas variam de forma generosa, entre 51m² e 109m², com varandas, jardins ou terraços que prolongam os espaços interiores e criam uma ligação direta com o exterior. Todas as unidades contam com lugares de garagem e, em alguns casos, arrecadação.

Os acabamentos reforçam a identidade premium do projeto:

Salas e quartos com pavimento em soalho multicamadas de madeira de carvalho, que garante conforto e elegância.
Casas de banho modernas, com louça suspensa, móveis de lavatório suspensos e revestimentos em cerâmica retificada, que aliam estética e durabilidade.
Cozinhas totalmente equipadas com placa vitrocerâmica, forno, micro-ondas, frigorífico, máquina de lavar louça e exaustor, para além de móveis de acabamento luxuoso e tampos em Quartz Compact.
Fachada ventilada revestida a Stacbond, caixilharias em alumínio lacado com vidro duplo, estores elétricos e porta de segurança.
Sistema de aquecimento ambiente e águas sanitárias por bomba de calor, assegurando eficiência energética e conforto durante todo o ano.

A arquitetura do Sul 482 valoriza a luminosidade natural, a amplitude dos espaços e a ligação entre interior e exterior, criando ambientes ideais tanto para o dia a dia como para momentos de lazer.

Viver aqui é estar perto do mar, mas também de restaurantes, escolas, comércio local, ciclovias e toda a dinâmica que faz de Matosinhos Sul uma das zonas mais procuradas e valorizadas da Área Metropolitana do Porto.

O Sul 482 Matosinhos é mais do que um edifício — é um convite a viver com qualidade, sofisticação e proximidade com o que realmente importa.",Diogo Maia,https://i.maxwork.pt/l-feat/listings/12099/7010550/718bd643-8eb6-491e-8230-739a4b9acbb0.jpg,https://i.maxwork.pt/ds-l/listings/12099/7010550/9e1efb46-0501-445f-a5cb-c07a5f3f6689.jpg,https://i.maxwork.pt/ds-l/listings/12099/7010550/f1fee6bf-03e6-4164-a114-b24ac214aebe.jpg,https://i.maxwork.pt/ds-l/listings/12099/7010550/9375a8e7-4bc3-41ea-9aa5-44d37ff4d58e.jpg,https://i.maxwork.pt/ds-l/listings/12099/7010550/a598255c-82af-4c2d-8053-4e905d53a172.jpg,https://i.maxwork.pt/ds-l/listings/12099/7010550/f3d8d631-c80d-4c96-914f-6fd490a8f440.jpg,https://i.maxwork.pt/ds-l/listings/12099/7010550/4dd6619f-7427-42b6-9366-3f0d39bbfa8f.jpg,https://i.maxwork.pt/ds-l/listings/12099/7010550/b1f7ecb1-a9ac-4ad2-8119-358d7a0ce54f.jpg,https://i.maxwork.pt/ds-l/listings/12099/7010550/f2d65105-cb64-442c-af4d-15b0b25b29ce.jpg,https://i.maxwork.pt/ds-l/listings/12099/7010550/8e33281c-5e5c-4071-b3df-de1979a5db9e.jpg,,,,,,,,,,,,,,,
2025-12-20 03:07:27,Successful,https://dashboard.browse.ai/workspaces/miguel-pinto/robots/bc1be172-8182-411a-a043-eb327d30c661/history/019b39b9-a7cd-7dee-b3b1-fa163e097515,https://remax.pt/pt/imoveis/venda-apartamento-t3-matosinhos-matosinhos-e-leca-da-palmeira/120992654-501,Apartamento T3 em Matosinhos com elevador,Matosinhos e Leça da Palmeira,605 000 €,Venda,id. 120992654-501,104 m²,3 Quartos,3 WC,A+,"Apartamento T3 para vendaSUL 560 | Matosinhos Sul

Uma nova forma de viver entre o mar e a cidade

O SUL 560 é um empreendimento residencial de excelência, concebido para oferecer uma experiência de vida que alia sofisticação, funcionalidade e proximidade ao mar, no centro de uma das localizações mais valorizadas da Área Metropolitana do Porto: Matosinhos Sul.Localização Privilegiada

Localizado na Rua Afonso Cordeiro, o SUL 560 beneficia de uma posição estratégica, a poucos minutos a pé da praia e com acesso direto à estação de metro. Esta localização única proporciona um quotidiano equilibrado entre a tranquilidade do litoral e a vibração urbana, com comércio local, restaurantes, escolas, serviços, zonas verdes e equipamentos culturais nas imediações.

A proximidade ao Parque da Cidade do Porto e ao Terminal de Cruzeiros reforça o potencial de valorização e a atratividade para quem procura investir com inteligência ou viver com qualidade.Arquitetura e Design

Com uma estética contemporânea e linhas arquitetónicas elegantes, o SUL 560 distingue-se pelas suas fachadas sóbrias e modernas, que integram-se harmoniosamente na envolvente urbana.

Cada apartamento foi cuidadosamente projetado para maximizar o conforto e a luz natural, privilegiando a amplitude, a funcionalidade dos espaços e a ligação fluida entre interior e exterior. As varandas e terraços generosos prolongam a vivência das áreas sociais e proporcionam vistas desafogadas e momentos de lazer ao ar livre.

Os materiais e acabamentos foram criteriosamente selecionados, obedecendo a elevados padrões de qualidade e durabilidade, com soluções técnicas e estéticas que valorizam o detalhe, o conforto térmico e acústico, e a eficiência energética.Composição do Empreendimento

22 Apartamentos distribuídos por tipologias T1, T2 e T3, adequados tanto para jovens profissionais como para famílias.

2 Espaços Comerciais no piso térreo, ideais para comércio de proximidade ou serviços.

Estacionamento privativo e zonas de arrumos para maior comodidade dos residentes.Interiores Pensados para Viver Melhor

Os apartamentos do SUL 560 apresentam plantações bem estruturadas, com zonas sociais amplas, cozinhas totalmente equipadas e quartos com roupeiros embutidos e, em muitas frações, suíte.

A atenção ao detalhe estende-se aos acabamentos:

Pavimentos flutuantes em madeira ou equivalente de alta resistência

Louças sanitárias suspensas e torneiras de design contemporâneo

Cozinhas com eletrodomésticos encastrados

Iluminação LED embutida

Pré-instalação de ar condicionado e soluções eficientes de isolamento térmico e acústicoEspaços Comuns que Elevam a Qualidade de Vida

O SUL 560 foi desenhado para ir além da habitação convencional, oferecendo espaços comuns que acrescentam valor real à experiência de viver aqui:

Ginásio com luz natural, exclusivo para os moradores, ideal para treinar com conforto e segurança

Áreas verdes comuns, pensadas como zonas de relaxamento, convívio e bem-estar

Hall de entrada com design contemporâneo, que reflete o cuidado estético do projeto desde o primeiro contactoPara Viver ou Investir com Segurança

O SUL 560 representa uma oportunidade rara de viver com qualidade num dos bairros mais cobiçados do Grande Porto. A sua localização, aliada à qualidade da construção e ao cuidado na conceção dos espaços, fazem deste projeto uma escolha segura, seja para residência própria, segunda habitação ou investimento para arrendamento.

Com a construção a cargo da CVM Construções, empresa reconhecida pela sua competência técnica e solidez no mercado, o projeto assegura elevados padrões de execução e fiabilidade.",Diogo Maia,https://i.maxwork.pt/l-feat/listings/12099/7013701/f1812dd2-4627-4639-b381-230b327af11d.jpg,https://i.maxwork.pt/ds-l/listings/12099/7013701/2c1bb174-c0ba-47eb-b40e-8e079417b343.jpg,https://i.maxwork.pt/ds-l/listings/12099/7013701/c339c5dd-9ded-4793-9dbb-6ea3b06c6451.jpg,https://i.maxwork.pt/ds-l/listings/12099/7013701/8777f657-1ca6-4c14-a53e-c30e4fc9686f.jpg,https://i.maxwork.pt/ds-l/listings/12099/7013701/1856e661-17d3-4d0f-99b6-5be8f625ee8a.jpg,https://i.maxwork.pt/ds-l/listings/12099/7013701/48125de2-ec23-46a2-8604-e4a6e8ff9bd1.jpg,https://i.maxwork.pt/ds-l/listings/12099/7013701/75008769-2fe5-4d77-a68c-1a8acaee9cfc.jpg,https://i.maxwork.pt/ds-l/listings/12099/7013701/b82ee91d-d819-46b2-82d8-eaf2bfacac80.jpg,https://i.maxwork.pt/ds-l/listings/12099/7013701/534a53b0-bd6f-4d59-806a-0a9d05c13aff.jpg,,,,,,,,,,,,,,,,
2025-12-20 03:07:26,Successful,https://dashboard.browse.ai/workspaces/miguel-pinto/robots/bc1be172-8182-411a-a043-eb327d30c661/history/019b39b9-a7cd-7509-a136-7f7eed2ed1a5,https://remax.pt/pt/imoveis/venda-apartamento-t2-matosinhos-matosinhos-e-leca-da-palmeira/120992654-502,Apartamento T2 em Matosinhos com elevador,Matosinhos e Leça da Palmeira,425 000 €,Venda,id. 120992654-502,69 m²,2 Quartos,2 WC,A+,"SUL 560 | Matosinhos Sul

Uma nova forma de viver entre o mar e a cidade

O SUL 560 é um empreendimento residencial de excelência, concebido para oferecer uma experiência de vida que alia sofisticação, funcionalidade e proximidade ao mar, no centro de uma das localizações mais valorizadas da Área Metropolitana do Porto: Matosinhos Sul.Localização Privilegiada

Localizado na Rua Afonso Cordeiro, o SUL 560 beneficia de uma posição estratégica, a poucos minutos a pé da praia e com acesso direto à estação de metro. Esta localização única proporciona um quotidiano equilibrado entre a tranquilidade do litoral e a vibração urbana, com comércio local, restaurantes, escolas, serviços, zonas verdes e equipamentos culturais nas imediações.

A proximidade ao Parque da Cidade do Porto e ao Terminal de Cruzeiros reforça o potencial de valorização e a atratividade para quem procura investir com inteligência ou viver com qualidade.Arquitetura e Design

Com uma estética contemporânea e linhas arquitetónicas elegantes, o SUL 560 distingue-se pelas suas fachadas sóbrias e modernas, que integram-se harmoniosamente na envolvente urbana.

Cada apartamento foi cuidadosamente projetado para maximizar o conforto e a luz natural, privilegiando a amplitude, a funcionalidade dos espaços e a ligação fluida entre interior e exterior. As varandas e terraços generosos prolongam a vivência das áreas sociais e proporcionam vistas desafogadas e momentos de lazer ao ar livre.

Os materiais e acabamentos foram criteriosamente selecionados, obedecendo a elevados padrões de qualidade e durabilidade, com soluções técnicas e estéticas que valorizam o detalhe, o conforto térmico e acústico, e a eficiência energética.Composição do Empreendimento

22 Apartamentos distribuídos por tipologias T1, T2 e T3, adequados tanto para jovens profissionais como para famílias.

2 Espaços Comerciais no piso térreo, ideais para comércio de proximidade ou serviços.

Estacionamento privativo e zonas de arrumos para maior comodidade dos residentes.Interiores Pensados para Viver Melhor

Os apartamentos do SUL 560 apresentam plantações bem estruturadas, com zonas sociais amplas, cozinhas totalmente equipadas e quartos com roupeiros embutidos e, em muitas frações, suíte.

A atenção ao detalhe estende-se aos acabamentos:

Pavimentos flutuantes em madeira ou equivalente de alta resistência

Louças sanitárias suspensas e torneiras de design contemporâneo

Cozinhas com eletrodomésticos encastrados

Iluminação LED embutida

Pré-instalação de ar condicionado e soluções eficientes de isolamento térmico e acústicoEspaços Comuns que Elevam a Qualidade de Vida

O SUL 560 foi desenhado para ir além da habitação convencional, oferecendo espaços comuns que acrescentam valor real à experiência de viver aqui:

Ginásio com luz natural, exclusivo para os moradores, ideal para treinar com conforto e segurança

Áreas verdes comuns, pensadas como zonas de relaxamento, convívio e bem-estar

Hall de entrada com design contemporâneo, que reflete o cuidado estético do projeto desde o primeiro contactoPara Viver ou Investir com Segurança

O SUL 560 representa uma oportunidade rara de viver com qualidade num dos bairros mais cobiçados do Grande Porto. A sua localização, aliada à qualidade da construção e ao cuidado na conceção dos espaços, fazem deste projeto uma escolha segura, seja para residência própria, segunda habitação ou investimento para arrendamento.

Com a construção a cargo da CVM Construções, empresa reconhecida pela sua competência técnica e solidez no mercado, o projeto assegura elevados padrões de execução e fiabilidade.",Diogo Maia,https://i.maxwork.pt/l-feat/listings/12099/7013704/b4de3f16-60a3-4581-8321-c77f917acc29.jpg,https://i.maxwork.pt/ds-l/listings/12099/7013704/baeaaa0b-085c-438e-9019-a535379f3c42.jpg,https://i.maxwork.pt/ds-l/listings/12099/7013704/7df01d73-b343-4c78-8fd5-ae2a1ba77a8b.jpg,https://i.maxwork.pt/ds-l/listings/12099/7013704/5d2e35a3-ade8-4dae-a4a1-cfda8dd5e237.jpg,https://i.maxwork.pt/ds-l/listings/12099/7013704/8c68e33c-da14-4128-8d56-ed59914ea29f.jpg,https://i.maxwork.pt/ds-l/listings/12099/7013704/a50f8395-1ee1-4ba7-afae-18ae98bdaec9.jpg,https://i.maxwork.pt/ds-l/listings/12099/7013704/fbafac3e-185e-4961-a4e3-9f3c99f31e6c.jpg,https://i.maxwork.pt/ds-l/listings/12099/7013704/29026c8c-86a5-4c85-a768-5a2dc2a8db8c.jpg,https://i.maxwork.pt/ds-l/listings/12099/7013704/30a87e9b-e167-4a03-883c-2aa8669fae37.jpg,,,,,,,,,,,,,,,,
