Extract Date,Status,Task Link,Origin URL,Title,Location,Price,Tag,ID,Area,Bedrooms,Bathrooms,Energy Class,Description,Agent Name,Main Image,Image1,Image2,Image3,Image4,Image5,Image6,Image7,Image8,Image9,Image10,Image11,Image12,Image13,Image14,Image15,Image16,Image17,Image18,Image19,Image20,Image21,Image22,Image23,Image24
2025-12-20 03:07:20,Successful,https://dashboard.browse.ai/workspaces/miguel-pinto/robots/bc1be172-8182-411a-a043-eb327d30c661/history/019b39b9-a7ca-758c-8863-9a83d2d6286e,https://remax.pt/pt/imoveis/venda-apartamento-t3-montijo-montijo-e-afonsoeiro/120992654-551,Apartamento T3 em Montijo com 170 m²,Montijo e Afonsoeiro,430 000 €,Venda,id. 120992654-551,170 m²,3 Quartos,4 WC,A,"Apartamento T3 Duplex | Novo | Montijo

Magnífico e exclusivo apartamento T3, verdadeiramente único no mercado, situado no coração do Centro do Montijo. Inserido num edifício contemporâneo com apenas dois apartamentos, oferece um ambiente de total privacidade, conforto e exclusividade. O seu design moderno, aliado aos acabamentos de elevada qualidade, garante uma experiência de habitação superior.

Ao entrar no imóvel, é recebido por um ambiente sofisticado, onde cada detalhe foi cuidadosamente pensado para proporcionar funcionalidade e elegância. A porta blindada assegura segurança reforçada, enquanto o teto falso em pladur com iluminação embutida confere ao espaço uma atmosfera moderna e acolhedora.

A ampla zona social integra sala e cozinha num conceito open space, com um total de 33,57 m², permitindo uma excelente circulação e luminosidade. A cozinha encontra-se totalmente equipada com eletrodomésticos Siemens, garantindo performance, durabilidade e um toque de luxo. O pavimento combina cerâmica e soalho flutuante de alta qualidade, criando uma estética harmoniosa e funcional.

O apartamento dispõe ainda de um WC social elegante, totalmente equipado com móvel e espelho, proporcionando conforto adicional aos seus visitantes.

No que respeita à zona privada, o imóvel oferece três suites, todas com roupeiros embutidos e casas de banho completas, equipadas com móveis, espelhos e poliban com resguardo em vidro, assegurando qualidade e requinte.
A Suite I, com generosos 20,20 m², inclui um WC de 4,12 m².
A Suite II, com 11,75 m², conta com WC privativo de 4,37 m².
A Suite III, com 10,69 m², destaca-se pela sua privacidade e funcionalidade, complementada por um WC de 3,16 m².
A Suite principal inclui ainda um elegante closet, oferecendo uma zona de arrumação ampla e organizada.

Um dos grandes destaques deste apartamento são os seus três terraços, perfeitos para tirar partido dos dias de sol, criar zonas de lazer ou simplesmente relaxar. Um dos terraços dispõe de churrasqueira, ideal para convívios e refeições ao ar livre.

Outros elementos que reforçam o conforto e a eficiência do imóvel incluem ar condicionado, caixilharia em PVC com vidros duplos, estores elétricos e uma excelente qualidade de construção, pensada para garantir isolamento, tranquilidade e bem-estar.

Este apartamento representa uma oportunidade rara de viver com todo o conforto e privacidade no centro da cidade, num espaço moderno, elegante e com características pouco comuns no mercado local.

Venha visitar.",Diogo Maia,https://i.maxwork.pt/l-feat/listings/12099/7082193/01a07b04-3c98-4f3d-be5a-712070ba4a21.jpg,https://i.maxwork.pt/ds-l/listings/12099/7082193/3d9b2ba8-54e9-4927-ae5e-e0aa4b9fdf0b.jpg,https://i.maxwork.pt/ds-l/listings/12099/7082193/4aa31ffb-df5b-4279-a932-14ef514ff7b4.jpg,https://i.maxwork.pt/ds-l/listings/12099/7082193/3ee69951-64c1-466e-a20c-af39616fbaa1.jpg,https://i.maxwork.pt/ds-l/listings/12099/7082193/80fdb589-18ac-4a2a-8672-094c95559c04.jpg,https://i.maxwork.pt/ds-l/listings/12099/7082193/02d30a00-3926-40a3-ab05-a280c43f28ab.jpg,https://i.maxwork.pt/ds-l/listings/12099/7082193/a73dd189-c6f2-41c4-a419-e0e2af6fa784.jpg,https://i.maxwork.pt/ds-l/listings/12099/7082193/e98756a6-b904-4f13-a427-aa7f43cc1b31.jpg,https://i.maxwork.pt/ds-l/listings/12099/7082193/dbc41f17-ee0b-4847-9a3b-007052b79b71.jpg,https://i.maxwork.pt/ds-l/listings/12099/7082193/ac9f9698-3e40-4cde-81ea-ca26ca4dc0b5.jpg,https://i.maxwork.pt/ds-l/listings/12099/7082193/0c4c9f54-1325-4e46-8f11-0fa4c392fe1c.jpg,https://i.maxwork.pt/ds-l/listings/12099/7082193/02de3f90-e783-476e-9997-bf63b24fec3b.jpg,https://i.maxwork.pt/ds-l/listings/12099/7082193/e1bed908-57c7-426d-a696-3fd745f5a96a.jpg,https://i.maxwork.pt/ds-l/listings/12099/7082193/6993fa91-fb94-4967-b98c-b3a98c4c239b.jpg,https://i.maxwork.pt/ds-l/listings/12099/7082193/734b9589-e1b6-4bfc-826e-812cd4d8d269.jpg,https://i.maxwork.pt/ds-l/listings/12099/7082193/7fe0d3a8-96f3-4793-b87b-21683e76bd7e.jpg,https://i.maxwork.pt/ds-l/listings/12099/7082193/4e877921-90f0-4cbf-acc0-4c960d288a7e.jpg,https://i.maxwork.pt/ds-l/listings/12099/7082193/315dadab-56e1-4328-8ab9-7fe1533fa550.jpg,https://i.maxwork.pt/ds-l/listings/12099/7082193/df53b041-664f-4a19-8d97-3c3d99a927d4.jpg,https://i.maxwork.pt/ds-l/listings/12099/7082193/419dcfed-3284-438b-9aea-7dc16e309fba.jpg,https://i.maxwork.pt/ds-l/listings/12099/7082193/db162e2e-4538-4b6a-b9e5-1ba0a8edde5a.jpg,https://i.maxwork.pt/ds-l/listings/12099/7082193/6b116166-f40c-47e2-92b6-1b0bd9dbbb94.jpg,https://i.maxwork.pt/ds-l/listings/12099/7082193/a807ecb8-4c73-4412-a657-1d88519037fd.jpg,https://i.maxwork.pt/ds-l/listings/12099/7082193/313eaaab-9194-4bc6-9c2a-1df4997e0c77.jpg,https://i.maxwork.pt/ds-l/listings/12099/7082193/36a47023-9896-488a-8a47-72bac828dba0.jpg
2025-12-20 03:07:19,Successful,https://dashboard.browse.ai/workspaces/miguel-pinto/robots/bc1be172-8182-411a-a043-eb327d30c661/history/019b39b9-a7cb-7f21-9d2c-1a812f8904ab,https://remax.pt/pt/imoveis/venda-moradia-t5-sesimbra-quinta-do-conde/120992654-541,Moradia T5 em Sesimbra com 3+ lugares de garagem,Quinta do Conde,1 900 000 €,Venda,id. 120992654-541,292 m²,5 Quartos,4 WC,D,"Moradia | Exclusiva | Quinta do Peru

Moradia T4 de luxo, inserida num lote de 1.517 m², localizada numa zona residencial de excelência, com acesso direto e exclusivo a um campo de golfe.
Este imóvel oferece o equilíbrio perfeito entre elegância, tranquilidade e qualidade de vida, tornando-se a escolha ideal para quem procura um refúgio de conforto e requinte a poucos minutos dos principais acessos urbanos.

 Envolvente e Exterior

Integrada num condomínio privado de prestígio, com vigilância 24 horas por dia, esta propriedade oferece um ambiente de total segurança e privacidade.
O extenso espaço exterior foi pensado para proporcionar momentos únicos de lazer, em perfeita harmonia com a natureza envolvente.

Destaques do exterior:

Jardim paisagístico com manutenção cuidada e áreas verdes amplas;

Telheiro coberto com barbecue, perfeito para refeições ao ar livre e convívios em família;

Piscina aquecida de grandes dimensões, ideal para usufruir em qualquer época do ano;

Jacuzzi privativo, que convida ao relaxamento e bem-estar;

Estacionamento privativo para seis viaturas, com acesso direto à propriedade;

Ligação direta ao campo de golfe, ideal para os amantes deste desporto e para quem aprecia o contacto com a natureza.

Distribuição Interior

Com uma distribuição funcional e harmoniosa, esta moradia destaca-se pelos espaços amplos, luminosos e bem estruturados, privilegiando a comodidade e o estilo de vida familiar.

Piso Térreo:

Sala de estar espaçosa com lareira e grandes vãos envidraçados, que garantem abundante luz natural e ligação direta ao jardim e à piscina;

Sala de jantar elegante, separada por um ambiente acolhedor e ideal para receber convidados;

Cozinha moderna e totalmente equipada, com armários de elevado padrão e zona de refeições;

Suite generosa com casa de banho privativa, ideal para hóspedes ou utilização no quotidiano;

Sala adicional com mezanino, perfeita para escritório, sala de leitura, cinema ou espaço de lazer;

Casa de banho completa e casa de banho social de apoio à zona comum.

Primeiro Andar:

Dois quartos amplos, com ótima exposição solar e vista para o campo de golfe;

Casa de banho completa com duas portas, permitindo acesso direto e funcional a ambos os quartos.

Cave:

Espaço com excelentes dimensões, ideal para arrumos, lavandaria, zona técnica ou até ginásio;

Área versátil, que permite adaptação às necessidades específicas de cada família.

Conforto, Tecnologia e Detalhes de Qualidade

Esta moradia foi projetada para garantir o máximo de conforto e eficiência, com acabamentos de alto padrão e equipamentos de última geração.

Características técnicas e de conforto:

Aquecimento central em todas as divisões;

Sistema de som ambiente integrado;

Sistema de alarme e segurança de última geração;

Materiais e revestimentos premium, cuidadosamente selecionados;

Caixilharias de alta qualidade com isolamento térmico e acústico;

Iluminação natural abundante, potenciada pela arquitetura e pela orientação solar;

Acesso direto e privativo ao campo de golfe, um privilégio reservado a poucos.

Condomínio de Prestígio e Estilo de Vida Exclusivo

O condomínio onde esta moradia se insere foi pensado para proporcionar um estilo de vida completo e sofisticado.
Para além da segurança permanente, oferece:

Restaurante exclusivo para residentes;

Clubhouse elegante e acolhedor, ponto de encontro e convívio social;

Áreas verdes e vistas desafogadas, que reforçam a sensação de tranquilidade e exclusividade.

Aqui, cada detalhe foi concebido para oferecer uma vivência única, onde o luxo se combina com a serenidade do ambiente envolvente.",Diogo Maia,https://i.maxwork.pt/l-feat/listings/12099/7079854/305bc1c0-5811-4325-9d21-601300f7779a.jpg,https://i.maxwork.pt/ds-l/listings/12099/7079854/f8f26b66-249e-4657-9ae1-7cf2d91c4f8b.jpg,https://i.maxwork.pt/ds-l/listings/12099/7079854/aad60542-d15f-454f-8468-0fea7d4cb2d3.jpg,https://i.maxwork.pt/ds-l/listings/12099/7079854/0611f2ea-bdcd-41a6-a0d9-106d168147fe.jpg,https://i.maxwork.pt/ds-l/listings/12099/7079854/23b56110-0335-4662-b361-08d32810e554.jpg,https://i.maxwork.pt/ds-l/listings/12099/7079854/4f30a4fe-4075-43bf-aa65-d5b2ecdc1772.jpg,https://i.maxwork.pt/ds-l/listings/12099/7079854/c64b063a-1dc3-4dcc-8961-4c38cac27d99.jpg,https://i.maxwork.pt/ds-l/listings/12099/7079854/bbb2cb49-7172-42c4-ba35-a1bd05e21128.jpg,https://i.maxwork.pt/ds-l/listings/12099/7079854/a4cce823-0914-4145-b1af-fc3dca8ea28b.jpg,https://i.maxwork.pt/ds-l/listings/12099/7079854/ff28a384-8a9c-4f2e-8485-f254e1604ea0.jpg,https://i.maxwork.pt/ds-l/listings/12099/7079854/eb4e9f9f-4418-4b4e-90bd-2e0e1cc50e96.jpg,https://i.maxwork.pt/ds-l/listings/12099/7079854/e916e53e-6fc9-4d2c-97fa-e074bafd15f0.jpg,https://i.maxwork.pt/ds-l/listings/12099/7079854/5d5103c7-263d-480c-a26b-d7fdf704f808.jpg,https://i.maxwork.pt/ds-l/listings/12099/7079854/4c709f6b-3840-4273-8a06-acd882cbad86.jpg,https://i.maxwork.pt/ds-l/listings/12099/7079854/91b8293b-c7c1-42c0-bdaf-5fbe9372199e.jpg,https://i.maxwork.pt/ds-l/listings/12099/7079854/2adff708-f29e-4822-a381-95f4d7042807.jpg,https://i.maxwork.pt/ds-l/listings/12099/7079854/c3b834d1-6bd1-4269-8df6-391565f823d2.jpg,https://i.maxwork.pt/ds-l/listings/12099/7079854/c9d77d5c-3513-44fc-9ef4-b828b70e7063.jpg,https://i.maxwork.pt/ds-l/listings/12099/7079854/7e0d1723-2666-4ae9-ab64-8d1912771926.jpg,https://i.maxwork.pt/ds-l/listings/12099/7079854/6f2835e9-cb3e-4825-a28e-f3d478603c06.jpg,https://i.maxwork.pt/ds-l/listings/12099/7079854/d4913619-d997-4b20-9a7a-6077e7952dc6.jpg,https://i.maxwork.pt/ds-l/listings/12099/7079854/b07227ee-ace3-4f0d-83f2-6c997f90ebab.jpg,https://i.maxwork.pt/ds-l/listings/12099/7079854/6bac6f09-67ab-4b8f-bda4-6c28db399021.jpg,https://i.maxwork.pt/ds-l/listings/12099/7079854/ab330be2-4785-4812-9a39-3f47d1e6bcaf.jpg,https://i.maxwork.pt/ds-l/listings/12099/7079854/69b87075-9bf4-4d42-9f7b-c2b0a55a3751.jpg
2025-12-20 03:07:19,Successful,https://dashboard.browse.ai/workspaces/miguel-pinto/robots/bc1be172-8182-411a-a043-eb327d30c661/history/019b39b9-a7ca-7375-9787-69a96c7c968c,https://remax.pt/pt/imoveis/venda-apartamento-t3-lisboa-olivais/120992654-561,Apartamento T3 em Lisboa com 72 m²,Olivais,330 000 €,Venda,id. 120992654-561,72 m²,3 Quartos,1 WC,C,"Apartamento T3 | Olivais

Apresento este fantástico apartamento T3, situado numa das zonas
mais centrais e procuradas dos Olivais, a poucos passos da estação de
metro.

Este imóvel destaca-se pela sua localização estratégica, que
oferece facilidade de acesso a transportes públicos, comércio local,
escolas e espaços verdes. Com divisões amplas e luminosas, o apartamento
é ideal para quem procura conforto e praticidade no dia a dia.

Composto por uma sala espaçosa, três quartos bem dimensionados,
cozinha equipada e uma casa de banho, este T3 é perfeito para famílias
ou para quem valoriza qualidade de vida com mobilidade urbana.

Venha visitar!",Diogo Maia,https://i.maxwork.pt/l-feat/listings/12099/7085605/c64415f7-3fff-4479-ac59-2b50690ff2c9.jpg,https://i.maxwork.pt/ds-l/listings/12099/7085605/0eb6fa83-2978-407e-9be5-f7035edfb18b.jpg,https://i.maxwork.pt/ds-l/listings/12099/7085605/9157686d-ea44-428d-beeb-8e85539837e6.jpg,https://i.maxwork.pt/ds-l/listings/12099/7085605/14406383-f6e8-4376-8301-630170e48525.jpg,https://i.maxwork.pt/ds-l/listings/12099/7085605/bfbcdb96-842d-4f05-86b3-d560b92d8d92.jpg,https://i.maxwork.pt/ds-l/listings/12099/7085605/26d8ae22-6573-44d8-8d7a-760397d04129.jpg,https://i.maxwork.pt/ds-l/listings/12099/7085605/ca75dd39-9d69-4f6e-b5e9-ccad8e3af563.jpg,https://i.maxwork.pt/ds-l/listings/12099/7085605/2231b570-0f35-46b2-a2e5-e89cf44a3bd4.jpg,https://i.maxwork.pt/ds-l/listings/12099/7085605/f6168d04-3e99-4b14-bfa7-74f92f9a7ba3.jpg,https://i.maxwork.pt/ds-l/listings/12099/7085605/fd954270-22e4-4b04-b2b6-6759a4350de2.jpg,https://i.maxwork.pt/ds-l/listings/12099/7085605/8cea347b-d857-40b6-a98a-d53a441662f9.jpg,https://i.maxwork.pt/ds-l/listings/12099/7085605/6d780659-6508-437e-a718-4096b15c15f0.jpg,https://i.maxwork.pt/ds-l/listings/12099/7085605/6ca832f6-f7c4-4bf8-ad9e-0b86aea2127b.jpg,https://i.maxwork.pt/ds-l/listings/12099/7085605/8e3d8120-9a46-40af-89f8-6aff9377b20f.jpg,https://i.maxwork.pt/ds-l/listings/12099/7085605/e8dcf3f9-6229-4f32-af4c-cd12b38b9d10.jpg,https://i.maxwork.pt/ds-l/listings/12099/7085605/db612721-13b4-4893-8344-d91e401b2822.jpg,https://i.maxwork.pt/ds-l/listings/12099/7085605/6ff288cf-c9b1-4bde-aa05-7d040b748078.jpg,,,,,,,,
2025-12-20 03:07:19,Successful,https://dashboard.browse.ai/workspaces/miguel-pinto/robots/bc1be172-8182-411a-a043-eb327d30c661/history/019b39b9-a7cb-7b0a-95a7-1d930397fec4,https://remax.pt/pt/imoveis/venda-moradia-t4-alenquer-alenquer-santo-estevao-e-triana/120992654-525,Moradia T4 em Alenquer com 3+ lugares de garagem,Alenquer (Santo Estêvão e Triana),590 000 €,Venda,id. 120992654-525,177 m²,4 Quartos,3 WC,D,"Moradia | 4 Quartos | Alenquer


Apresento esta excelente moradia unifamiliar localizada em zona calma e residencial de Alenquer, inserida num condomínio de moradias, perfeita para quem procura tranquilidade, segurança e qualidade de vida a apenas 30 minutos de Lisboa.
Com uma área privativa de 177m², esta moradia está implantada num lote generoso de 701m², oferecendo amplos espaços interiores e exteriores, ideais para famílias ou para quem valoriza espaço e versatilidade.

Distribuição da moradia:

Rés-do-chão:

Ampla sala de estar com excelente exposição solar, proporcionando um ambiente luminoso e acolhedor.

Cozinha totalmente equipada, com eletrodomésticos modernos e espaço de arrumação.

Casa de banho de apoio.

Acesso direto ao exterior, com possibilidade de criar zona de refeições ao ar livre, jardim ou área de lazer.

Primeiro andar:

Três quartos com boas áreas, todos com janelas amplas e excelente entrada de luz natural.

Casa de banho completa, funcional e bem distribuída, servindo a zona privada da casa.

Segundo andar (sótão):

Espaço amplo e luminoso com grande potencial de aproveitamento. Ideal para criação de um escritório, sala de jogos, estúdio ou mesmo um terraço com vista panorâmica, conforme as necessidades da família.

Exterior:

O lote de 701m² oferece inúmeras possibilidades

Construção de piscina

Criação de zona de lazer ou churrasqueira

Jardim

Capacidade para estacionamento de 3 viaturas

Outros destaques:

Condomínio de moradias tranquilo e familiar

Bons acessos à A1 e ao centro de Alenquer

Excelente luminosidade natural em todas as divisões

Potencial de valorização

Ideal para residência própria ou investimento

Se procura uma moradia espaçosa, funcional e com grande potencial de personalização, esta pode ser a sua próxima casa.

Marque já a sua visita!",Diogo Maia,https://i.maxwork.pt/l-feat/listings/12099/7028181/a053eccc-482c-40ff-af23-5b4411bd99e6.jpg,https://i.maxwork.pt/ds-l/listings/12099/7028181/7a5cf4ad-a6d2-4ca7-89c2-b7d6946dc265.jpg,https://i.maxwork.pt/ds-l/listings/12099/7028181/74efc6fa-9b53-41c0-8d34-abf5c6e38554.jpg,https://i.maxwork.pt/ds-l/listings/12099/7028181/7af9f573-875f-4a28-8549-b157c71d82ee.jpg,https://i.maxwork.pt/ds-l/listings/12099/7028181/3c53785e-085d-444a-9412-7b72b1e316ee.jpg,https://i.maxwork.pt/ds-l/listings/12099/7028181/0070c76c-f006-4f9b-8c10-d344bf02d1a0.jpg,https://i.maxwork.pt/ds-l/listings/12099/7028181/468cdd9d-5916-43ac-a531-a01c6842d170.jpg,https://i.maxwork.pt/ds-l/listings/12099/7028181/e1f81fce-8ab9-4340-8ddc-5c96063197d2.jpg,https://i.maxwork.pt/ds-l/listings/12099/7028181/ba7e4a06-fcdd-41fe-83f7-6e49e3182c12.jpg,https://i.maxwork.pt/ds-l/listings/12099/7028181/eb4476db-c8f7-4504-b53e-3107dd33e039.jpg,https://i.maxwork.pt/ds-l/listings/12099/7028181/9fb8fa3c-e0b8-4e94-8cce-650b32bbb5be.jpg,https://i.maxwork.pt/ds-l/listings/12099/7028181/04e979d4-6316-42d1-b5e8-f834bdf5d4fe.jpg,https://i.maxwork.pt/ds-l/listings/12099/7028181/70df623c-45f5-420b-857f-7864f7b9155e.jpg,https://i.maxwork.pt/ds-l/listings/12099/7028181/9337e136-f851-428e-8c87-726e705a14b1.jpg,https://i.maxwork.pt/ds-l/listings/12099/7028181/48d9e539-a1c2-4af2-99e4-b5007af6ff8c.jpg,https://i.maxwork.pt/ds-l/listings/12099/7028181/777c7ec0-2bb1-4be4-9f6e-8554e2349b75.jpg,https://i.maxwork.pt/ds-l/listings/12099/7028181/4b5372ec-03b9-4a71-94ca-4231bdb45f86.jpg,https://i.maxwork.pt/ds-l/listings/12099/7028181/28c78e26-4e1f-4662-94c3-5d1fdde68bfd.jpg,https://i.maxwork.pt/ds-l/listings/12099/7028181/29524694-b1de-44f0-ac40-36fc081d7744.jpg,https://i.maxwork.pt/ds-l/listings/12099/7028181/f2d1a22b-531b-47f3-8d46-15eae45d2cc0.jpg,https://i.maxwork.pt/ds-l/listings/12099/7028181/09d93111-07e1-4e69-a553-8cc6afd8e1d4.jpg,https://i.maxwork.pt/ds-l/listings/12099/7028181/b83a95e4-744b-403f-bc02-6d65ad0c3876.jpg,https://i.maxwork.pt/ds-l/listings/12099/7028181/1913fecc-2261-4093-b499-69d4a4c1f259.jpg,https://i.maxwork.pt/ds-l/listings/12099/7028181/31be45c9-8147-4216-9bcb-bfa34de06dbf.jpg,https://i.maxwork.pt/ds-l/listings/12099/7028181/7cab605f-ac37-42cf-b34b-cd3e47df586c.jpg
2025-12-20 03:07:19,Successful,https://dashboard.browse.ai/workspaces/miguel-pinto/robots/bc1be172-8182-411a-a043-eb327d30c661/history/019b39b9-a7cb-74ff-9a36-c41c3ee4f4a9,https://remax.pt/pt/imoveis/venda-predio-tporto-cedofeita-santo-ildefonso-se-miragaia-sao-nicolau-e-vitoria/120992654-548,Prédio em Porto com 252 m²,"Cedofeita, Santo Ildefonso, Sé, Miragaia, São Nicolau e Vitória",590 000 €,Venda,id. 120992654-548,252 m²,- -,- -,NC,"Prédio | Projecto Aprovado | Porto

Edifício para reabilitação total, situado na prestigiada e histórica Rua da Lada, no coração da Ribeira do Porto, zona classificada como Património Mundial da UNESCO. Trata-se de um imóvel exclusivo, inserido numa das áreas de maior procura turística e valorização imobiliária da cidade.

Com uma localização privilegiada junto ao Douro, rodeado por comércio tradicional, restaurantes, pontos turísticos e elevada circulação pedonal, este prédio representa uma oportunidade única de investimento numa das zonas mais emblemáticas do Porto.

Atualmente classificado como “Edifício em Ruínas”, conforme documentação oficial emitida pelo Perito Qualificado (ADENE_SCE_SCE0000388339236), o imóvel permite uma intervenção de reabilitação integral sem necessidade de certificação energética no estado atual.

Pontos-Chave

Localização premium na Ribeira, zona turística de elevada valorização.

Forte potencial para projetos turísticos, alojamento local, boutique apartments ou habitação de charme.

Excelente exposição pedonal e envolvente turística ativa.

Elevado potencial de valorização após reabilitação.

Inserido numa das áreas mais rentáveis do Porto.

Documento oficial confirma a classificação como “Edifício em Ruínas”, permitindo intervenção imediata.

Potencial de Projeto

O edifício possui condições ideais para desenvolvimento de projetos residenciais ou turísticos altamente competitivos, beneficiando do fluxo contínuo de visitantes e da dinâmica económica do centro histórico do Porto. Trata-se de um ativo com grande capacidade de gerar rendimento e valorização rápida.

Venha visitar.",Diogo Maia,https://i.maxwork.pt/l-feat/listings/12099/7079016/bd298ead-0842-458a-8e7c-589e2f422f2c.jpg,https://i.maxwork.pt/ds-l/listings/12099/7079016/888d8886-8099-4de5-89d4-bb8c3c32d115.jpg,https://i.maxwork.pt/ds-l/listings/12099/7079016/e527e6a0-65dd-4eb9-a3aa-1e79716ed54e.jpg,https://i.maxwork.pt/ds-l/listings/12099/7079016/46976436-d570-4ffc-a8c9-c1535c31b6bd.jpg,https://i.maxwork.pt/ds-l/listings/12099/7079016/929fa383-d545-4e9a-be54-9851eea718c5.jpg,https://i.maxwork.pt/ds-l/listings/12099/7079016/d263d20b-e460-4d1e-b4d9-7a06c5524e10.jpg,https://i.maxwork.pt/ds-l/listings/12099/7079016/b3f63340-75bf-4279-9d7c-48688304e892.jpg,https://i.maxwork.pt/ds-l/listings/12099/7079016/1812958c-e6c6-4f47-89ae-599b8b85cccd.jpg,https://i.maxwork.pt/ds-l/listings/12099/7079016/9e555b52-5c93-402c-88d3-cc0af160aab8.jpg,https://i.maxwork.pt/ds-l/listings/12099/7079016/772e6643-b330-4348-a042-bd814540dbbd.jpg,https://i.maxwork.pt/ds-l/listings/12099/7079016/75945296-c8e3-4d77-aa88-63248f99ad7e.jpg,https://i.maxwork.pt/ds-l/listings/12099/7079016/5177257d-4bc8-4f3b-ab55-979ee0c41605.jpg,https://i.maxwork.pt/ds-l/listings/12099/7079016/e8944cdc-19c1-420d-aba9-52087abbcafe.jpg,https://i.maxwork.pt/ds-l/listings/12099/7079016/3c3ddca6-e77d-47b0-becc-d5156873f809.jpg,https://i.maxwork.pt/ds-l/listings/12099/7079016/0f823065-4866-4874-b68b-3ba9f7967425.jpg,https://i.maxwork.pt/ds-l/listings/12099/7079016/d48b5cd1-7a96-4a6e-89ad-7cfb71875cc0.jpg,https://i.maxwork.pt/ds-l/listings/12099/7079016/dc90b1c6-a0ff-4156-9104-9659b35f868d.jpg,https://i.maxwork.pt/ds-l/listings/12099/7079016/ffb963ea-45fc-42bc-a4af-3c5d328381c5.jpg,https://i.maxwork.pt/ds-l/listings/12099/7079016/1072cf2c-7039-4efe-b8be-2c8a0cbebb6f.jpg,https://i.maxwork.pt/ds-l/listings/12099/7079016/16bad95a-18bb-428e-a62f-cd834b08dfc9.jpg,https://i.maxwork.pt/ds-l/listings/12099/7079016/9c8c8f7e-3670-46ed-a8d4-75678bb5a8ee.jpg,https://i.maxwork.pt/ds-l/listings/12099/7079016/a7a18f80-f44a-4b07-adc4-0635d988e256.jpg,https://i.maxwork.pt/ds-l/listings/12099/7079016/3f8f347a-748d-4f01-be73-2d0a9a78bfbd.jpg,https://i.maxwork.pt/ds-l/listings/12099/7079016/b19003ea-a4a5-4246-bdb2-65b7f4e299fb.jpg,
