Extract Date,Status,Task Link,Origin URL,Title,Location,Price,Tag,ID,Area,Bedrooms,Bathrooms,Energy Class,Description,Agent Name,Main Image,Image1,Image2,Image3,Image4,Image5,Image6,Image7,Image8,Image9,Image10,Image11,Image12,Image13,Image14,Image15,Image16,Image17,Image18,Image19,Image20,Image21,Image22,Image23,Image24
2025-12-20 03:07:30,Successful,https://dashboard.browse.ai/workspaces/miguel-pinto/robots/bc1be172-8182-411a-a043-eb327d30c661/history/019b39b9-a7ce-7042-9339-97018d285f5d,https://remax.pt/pt/imoveis/venda-apartamento-t1-matosinhos-matosinhos-e-leca-da-palmeira/120992654-490,Apartamento T1 em Matosinhos com 1 lugar de garagem,Matosinhos e Leça da Palmeira,450 000 €,Venda,id. 120992654-490,78 m²,1 Quartos,1 WC,A,"Edifício Sul 482 – Matosinhos

Viver em Matosinhos Sul é ter todos os dias o privilégio de estar junto ao mar, rodeado por natureza e, ao mesmo tempo, com todas as comodidades da vida urbana. Aqui, a praia e o oceano tornam-se parte da rotina, o Parque da Cidade está a poucos minutos e o metro garante ligações rápidas e práticas ao centro do Porto e a toda a região. Um cenário perfeito para quem valoriza qualidade de vida, mobilidade e bem-estar.

O Sul 482 nasce desse conceito: oferecer não apenas apartamentos, mas um estilo de vida completo. O edifício foi concebido pela PFArchStudio, promovido pela CVM Investimentos e tem a execução a cargo da CVM Construções, reconhecida pela excelência dos seus projetos. Cada detalhe foi pensado para aliar design contemporâneo, funcionalidade e conforto, resultando num conjunto harmonioso e sofisticado.

Com apenas 10 frações exclusivas, o empreendimento garante privacidade e distinção. São 9 apartamentos de tipologias T1 e T2 e 1 espaço comercial, distribuídos por vários pisos. As áreas variam de forma generosa, entre 51m² e 109m², com varandas, jardins ou terraços que prolongam os espaços interiores e criam uma ligação direta com o exterior. Todas as unidades contam com lugares de garagem e, em alguns casos, arrecadação.

Os acabamentos reforçam a identidade premium do projeto:

Salas e quartos com pavimento em soalho multicamadas de madeira de carvalho, que garante conforto e elegância.
Casas de banho modernas, com louça suspensa, móveis de lavatório suspensos e revestimentos em cerâmica retificada, que aliam estética e durabilidade.
Cozinhas totalmente equipadas com placa vitrocerâmica, forno, micro-ondas, frigorífico, máquina de lavar louça e exaustor, para além de móveis de acabamento luxuoso e tampos em Quartz Compact.
Fachada ventilada revestida a Stacbond, caixilharias em alumínio lacado com vidro duplo, estores elétricos e porta de segurança.
Sistema de aquecimento ambiente e águas sanitárias por bomba de calor, assegurando eficiência energética e conforto durante todo o ano.

A arquitetura do Sul 482 valoriza a luminosidade natural, a amplitude dos espaços e a ligação entre interior e exterior, criando ambientes ideais tanto para o dia a dia como para momentos de lazer.

Viver aqui é estar perto do mar, mas também de restaurantes, escolas, comércio local, ciclovias e toda a dinâmica que faz de Matosinhos Sul uma das zonas mais procuradas e valorizadas da Área Metropolitana do Porto.

O Sul 482 Matosinhos é mais do que um edifício — é um convite a viver com qualidade, sofisticação e proximidade com o que realmente importa.",Diogo Maia,https://i.maxwork.pt/l-feat/listings/12099/7010002/1a3f5582-ed91-479f-b18f-3f299aab71cb.jpg,https://i.maxwork.pt/ds-l/listings/12099/7010002/81e04b61-21b4-41fe-b53e-c4285fb93db6.jpg,https://i.maxwork.pt/ds-l/listings/12099/7010002/e8f5a48e-a86f-4390-9085-4c3b93bcf1e6.jpg,https://i.maxwork.pt/ds-l/listings/12099/7010002/eaca0368-a58c-422e-90a8-5aa244e3062c.jpg,https://i.maxwork.pt/ds-l/listings/12099/7010002/a6a303bf-4083-49cd-b2ce-9bb6c2e02237.jpg,https://i.maxwork.pt/ds-l/listings/12099/7010002/a0ca50f5-1938-4811-a9ad-d98657648be7.jpg,https://i.maxwork.pt/ds-l/listings/12099/7010002/0a31868f-d9e8-462a-b4aa-11714ccbb1eb.jpg,https://i.maxwork.pt/ds-l/listings/12099/7010002/f05055e2-144c-4f42-b4a8-02c4ca4409a6.jpg,https://i.maxwork.pt/ds-l/listings/12099/7010002/03d8e6b0-df50-4bb1-9cc4-37b5186f41df.jpg,https://i.maxwork.pt/ds-l/listings/12099/7010002/917325d4-dd53-41fd-bbe6-b11c760bb9ed.jpg,,,,,,,,,,,,,,,
2025-12-20 03:07:30,Successful,https://dashboard.browse.ai/workspaces/miguel-pinto/robots/bc1be172-8182-411a-a043-eb327d30c661/history/019b39b9-a7cb-722e-9537-e2163449d160,https://remax.pt/pt/imoveis/venda-loja-tmatosinhos-matosinhos-e-leca-da-palmeira/120992654-523,Loja em Matosinhos com 1 lugar de garagem,Matosinhos e Leça da Palmeira,275 000 €,Venda,id. 120992654-523,62 m²,- -,- -,B,"SUL 560 | Matosinhos Sul

Uma nova forma de viver entre o mar e a cidade

O SUL 560 é um empreendimento residencial de excelência, concebido para oferecer uma experiência de vida que alia sofisticação, funcionalidade e proximidade ao mar, no centro de uma das localizações mais valorizadas da Área Metropolitana do Porto: Matosinhos Sul.

Localização Privilegiada

Localizado na Rua Afonso Cordeiro, o SUL 560 beneficia de uma posição estratégica, a poucos minutos a pé da praia e com acesso direto à estação de metro. Esta localização única proporciona um quotidiano equilibrado entre a tranquilidade do litoral e a vibração urbana, com comércio local, restaurantes, escolas, serviços, zonas verdes e equipamentos culturais nas imediações.

A proximidade ao Parque da Cidade do Porto e ao Terminal de Cruzeiros reforça o potencial de valorização e a atratividade para quem procura investir com inteligência ou viver com qualidade.

Arquitetura e Design

Com uma estética contemporânea e linhas arquitetónicas elegantes, o SUL 560 distingue-se pelas suas fachadas sóbrias e modernas, que integram-se harmoniosamente na envolvente urbana.

Cada apartamento foi cuidadosamente projetado para maximizar o conforto e a luz natural, privilegiando a amplitude, a funcionalidade dos espaços e a ligação fluida entre interior e exterior. As varandas e terraços generosos prolongam a vivência das áreas sociais e proporcionam vistas desafogadas e momentos de lazer ao ar livre.

Os materiais e acabamentos foram criteriosamente selecionados, obedecendo a elevados padrões de qualidade e durabilidade, com soluções técnicas e estéticas que valorizam o detalhe, o conforto térmico e acústico, e a eficiência energética.

Composição do Empreendimento

22 Apartamentos distribuídos por tipologias T1, T2 e T3, adequados tanto para jovens profissionais como para famílias.

2 Espaços Comerciais no piso térreo, ideais para comércio de proximidade ou serviços.

Estacionamento privativo e zonas de arrumos para maior comodidade dos residentes.Interiores Pensados para Viver Melhor

Os apartamentos do SUL 560 apresentam plantações bem estruturadas, com zonas sociais amplas, cozinhas totalmente equipadas e quartos com roupeiros embutidos e, em muitas frações, suíte.

A atenção ao detalhe estende-se aos acabamentos:

Pavimentos flutuantes em madeira ou equivalente de alta resistência

Louças sanitárias suspensas e torneiras de design contemporâneo

Cozinhas com eletrodomésticos encastrados

Iluminação LED embutida

Pré-instalação de ar condicionado e soluções eficientes de isolamento térmico e acústico

Espaços Comuns que Elevam a Qualidade de Vida

O SUL 560 foi desenhado para ir além da habitação convencional, oferecendo espaços comuns que acrescentam valor real à experiência de viver aqui:

Ginásio com luz natural, exclusivo para os moradores, ideal para treinar com conforto e segurança

Áreas verdes comuns, pensadas como zonas de relaxamento, convívio e bem-estar

Hall de entrada com design contemporâneo, que reflete o cuidado estético do projeto desde o primeiro contacto

Para Viver ou Investir com Segurança

O SUL 560 representa uma oportunidade rara de viver com qualidade num dos bairros mais cobiçados do Grande Porto. A sua localização, aliada à qualidade da construção e ao cuidado na conceção dos espaços, fazem deste projeto uma escolha segura, seja para residência própria, segunda habitação ou investimento para arrendamento.

Com a construção a cargo da CVM Construções, empresa reconhecida pela sua competência técnica e solidez no mercado, o projeto assegura elevados padrões de execução e fiabilidade.",Diogo Maia,https://i.maxwork.pt/l-feat/listings/12099/7013715/79e35dab-2afc-4fb4-94b7-8d20a96cae31.jpg,https://i.maxwork.pt/l-feat/listings/12099/7013715/09606a6a-3345-4cb1-a6f1-4175b03e0637.jpg,https://i.maxwork.pt/l-feat/listings/12099/7013715/61dcaafd-4fec-47c9-bbb4-aed8ed8270d1.jpg,,,,,,,,,,,,,,,,,,,,,,
2025-12-20 03:07:30,Successful,https://dashboard.browse.ai/workspaces/miguel-pinto/robots/bc1be172-8182-411a-a043-eb327d30c661/history/019b39b9-a7ce-7b8a-a6b8-050930d90ec1,https://remax.pt/pt/imoveis/venda-apartamento-t1-loures-santo-antonio-dos-cavaleiros-e-frielas/120992654-476,Apartamento T1 em Loures com elevador,Santo António dos Cavaleiros e Frielas,370 000 €,Venda,id. 120992654-476,85 m²,1 Quartos,1 WC,A+,"Élou | Oportunidade Única

Cedência de posição | Pronto no final de 2025 | Escritura até maio de 2026

Diga Élou à sua nova casa.

Com assinatura da prestigiada SOLYD, este é mais do que um apartamento — é um ponto de partida para quem quer viver (ou investir) com qualidade. 

 Imagine começar os dias com o sol a entrar suavemente pelo seu quarto e terminá-los com a luz dourada do entardecer a iluminar a sua sala. Este é o privilégio raro deste apartamento — com a melhor exposição solar de todo o empreendimento, nasce com luz e adormece em conforto. 

 Com áreas generosas, varandas perfeitas no quarto e sala para relaxar ao final do dia, e acabamentos de elevada qualidade, este T1 é um convite a viver com elegância e leveza. Inserido no exclusivo condomínio fechado Élou, este imóvel representa uma fusão perfeita entre sofisticação urbana, tranquilidade fora dos grandes centros e um investimento de excelência. 

Destaques que fazem a diferença:

-Projeto assinado pela prestigiada SOLYD Property Developers, uma referência no mercado nacional 

•⁠ ⁠Condomínio fechado com piscina, ginásio equipado, sala multiusos, lobby decorado e zonas verdes de lazer com relvados 

•⁠ ⁠Cozinha totalmente equipada com eletrodomésticos SMEG (ou equivalente) 

•⁠ ⁠Varanda privativa no quarto e na sala, áreas amplas, acabamentos premium e sistema de climatização 

•⁠ ⁠Estacionamento subterrâneo privativo, mobilidade elétrica e eficiência energética 

Localização estratégica:

(i) 10 minutos de carro até ao centro de Lisboa, aeroporto e Ponte Vasco da Gama 

(ii) 10 minutos a pé das paragens de autocarro 

(iii) 10–15 minutos a pé da futura estação de Metro (linha violeta) 

(iv) Proximidade a escolas, Hospital Beatriz Ângelo, IKEA, Loures Shopping e supermercados 

 Este não é apenas um imóvel — é um lugar para crescer, começar uma vida ou rentabilizar com excelente valorização. 

 Com alma, luz e um futuro promissor. 

Vamos visitar?",Diogo Maia,https://i.maxwork.pt/l-feat/listings/12099/7005055/513ec311-6fd5-4456-9648-1ef4bdcfd50c.jpg,https://i.maxwork.pt/ds-l/listings/12099/7005055/158abb6b-1514-49cf-96c9-1d829e204026.jpg,https://i.maxwork.pt/ds-l/listings/12099/7005055/05ff7deb-bec5-4f95-9f33-7bc6799ecba5.jpg,https://i.maxwork.pt/ds-l/listings/12099/7005055/10704c59-5d90-4484-995b-73af40ca7335.jpg,https://i.maxwork.pt/ds-l/listings/12099/7005055/69c9bacf-6e98-4894-adb6-789c185140a4.jpg,https://i.maxwork.pt/ds-l/listings/12099/7005055/4dd62d87-8b35-4770-92c4-c86fe979373c.jpg,https://i.maxwork.pt/ds-l/listings/12099/7005055/0d41e94a-1416-4892-83e2-a6631db2e4f9.jpg,https://i.maxwork.pt/ds-l/listings/12099/7005055/c42d2e56-c0a6-4793-a167-f95d9787cb1d.jpg,https://i.maxwork.pt/ds-l/listings/12099/7005055/bb9f58b8-f22e-4672-919b-276610da3296.jpg,https://i.maxwork.pt/ds-l/listings/12099/7005055/b4cf4b57-cdd0-4e51-9b5f-029130accbf7.jpg,https://i.maxwork.pt/ds-l/listings/12099/7005055/144e4ee3-83bc-40ed-86b8-b97fb8b3803b.jpg,https://i.maxwork.pt/ds-l/listings/12099/7005055/3cfec895-0d78-455d-9766-10f337eaaf66.jpg,https://i.maxwork.pt/ds-l/listings/12099/7005055/be348bfa-0651-45b1-866d-40e1844e5063.jpg,https://i.maxwork.pt/ds-l/listings/12099/7005055/735ef311-68ba-4608-aee7-9e4105fab2ce.jpg,https://i.maxwork.pt/ds-l/listings/12099/7005055/feecc1f6-5d64-480d-94dd-721601386edb.jpg,,,,,,,,,,
2025-12-20 03:07:30,Successful,https://dashboard.browse.ai/workspaces/miguel-pinto/robots/bc1be172-8182-411a-a043-eb327d30c661/history/019b39b9-a7ce-7a1d-9d7f-05b714d4c6b3,https://remax.pt/pt/imoveis/venda-apartamento-t3-vila-nova-de-gaia-sao-felix-da-marinha/120992654-486,Apartamento T3 em Vila Nova de Gaia com 2 lugares de garagem,São Felix da Marinha,460 000 €,Venda,id. 120992654-486,127 m²,3 Quartos,2 WC,A,"Apartamento T3 | Brito Living | São Felix da Marinha

O Brito Living é um moderno empreendimento residencial que nasce junto à Praia de Brito, numa localização estratégica entre Espinho e Vila Nova de Gaia, que oferece o equilíbrio perfeito entre tranquilidade, natureza e proximidade urbana.

Com projeto arquitetónico da autoria do prestigiado atelier DCM Arquitetos e construção da reconhecida empresa CVM, o Brito Living afirma-se pela sua arquitetura contemporânea, linhas elegantes e espaços concebidos para proporcionar conforto, funcionalidade e bem-estar.

O empreendimento disponibiliza apartamentos de tipologias T1, T2 e T3, com áreas generosas e plantas bem distribuídas, ideais tanto para habitação permanente como para casa de férias ou investimento.

Principais características:

Localização privilegiada: Situado a poucos metros da Praia de Brito, com ótimos acessos às cidades de Espinho e Vila Nova de Gaia.

Variedade de tipologias: Apartamentos T1, T2 e T3, com soluções adaptadas a diferentes necessidades familiares.

Espaços exteriores amplos: Varandas e terraços generosos, ideais para momentos de lazer e convívio ao ar livre.

Cozinhas modernas e equipadas com eletrodomésticos de qualidade, pensadas para o dia a dia contemporâneo.

Acabamentos de excelência: Materiais de qualidade superior, que garantem durabilidade, conforto e estética.

Estacionamento e acessibilidade: Lugares de garagem e acessos facilitados, com preocupação pela funcionalidade e segurança.

Vantagens do Brito Living:

Qualidade de vida a poucos passos do mar.

Arquitetura moderna e design funcional.

Proximidade a serviços, escolas, comércio e transportes.

Excelente oportunidade de investimento numa zona em valorização.

Se procura um apartamento novo, com estilo moderno, próximo da praia e com todas as comodidades, o Brito Living é a escolha certa para si.",Diogo Maia,https://i.maxwork.pt/l-feat/listings/12099/7009937/e2af028b-0748-4fd3-bed0-e652e0dcb1a9.jpg,https://i.maxwork.pt/ds-l/listings/12099/7009937/c4a8b5bf-58c6-47ab-bb03-502d9b4cce85.jpg,https://i.maxwork.pt/ds-l/listings/12099/7009937/63226b0e-94ee-450f-932e-b75b47b4f6a6.jpg,https://i.maxwork.pt/ds-l/listings/12099/7009937/313bd172-7e88-4171-946a-61844f8655b8.jpg,https://i.maxwork.pt/ds-l/listings/12099/7009937/f63f5fb3-1fa5-4f3e-82ff-879a0e38de26.jpg,https://i.maxwork.pt/ds-l/listings/12099/7009937/d3700e3b-15ba-4be1-aa1c-5664555d32aa.jpg,https://i.maxwork.pt/ds-l/listings/12099/7009937/34b0a390-5bdf-4f15-a0ca-b3f269a4283f.jpg,https://i.maxwork.pt/ds-l/listings/12099/7009937/c855919b-cc6b-4947-ab9b-3cb17df277a6.jpg,https://i.maxwork.pt/ds-l/listings/12099/7009937/96ee8118-e881-45e3-85a6-40e3225bf101.jpg,https://i.maxwork.pt/ds-l/listings/12099/7009937/b04458d2-7203-47a9-bf52-0904e1240079.jpg,https://i.maxwork.pt/ds-l/listings/12099/7009937/0967ddab-5e00-49bd-8567-c10c1c9ecf16.jpg,,,,,,,,,,,,,,
2025-12-20 03:07:30,Successful,https://dashboard.browse.ai/workspaces/miguel-pinto/robots/bc1be172-8182-411a-a043-eb327d30c661/history/019b39b9-a7ce-7383-8629-48781ac57004,https://remax.pt/pt/imoveis/venda-apartamento-t2-matosinhos-matosinhos-e-leca-da-palmeira/120992654-491,Apartamento T2 em Matosinhos com elevador,Matosinhos e Leça da Palmeira,550 000 €,Venda,id. 120992654-491,109 m²,2 Quartos,2 WC,A,"Edifício Sul 482 – Matosinhos

Viver em Matosinhos Sul é ter todos os dias o privilégio de estar junto ao mar, rodeado por natureza e, ao mesmo tempo, com todas as comodidades da vida urbana. Aqui, a praia e o oceano tornam-se parte da rotina, o Parque da Cidade está a poucos minutos e o metro garante ligações rápidas e práticas ao centro do Porto e a toda a região. Um cenário perfeito para quem valoriza qualidade de vida, mobilidade e bem-estar.

O Sul 482 nasce desse conceito: oferecer não apenas apartamentos, mas um estilo de vida completo. O edifício foi concebido pela PFArchStudio, promovido pela CVM Investimentos e tem a execução a cargo da CVM Construções, reconhecida pela excelência dos seus projetos. Cada detalhe foi pensado para aliar design contemporâneo, funcionalidade e conforto, resultando num conjunto harmonioso e sofisticado.

Com apenas 10 frações exclusivas, o empreendimento garante privacidade e distinção. São 9 apartamentos de tipologias T1 e T2 e 1 espaço comercial, distribuídos por vários pisos. As áreas variam de forma generosa, entre 51m² e 109m², com varandas, jardins ou terraços que prolongam os espaços interiores e criam uma ligação direta com o exterior. Todas as unidades contam com lugares de garagem e, em alguns casos, arrecadação.

Os acabamentos reforçam a identidade premium do projeto:

Salas e quartos com pavimento em soalho multicamadas de madeira de carvalho, que garante conforto e elegância.
Casas de banho modernas, com louça suspensa, móveis de lavatório suspensos e revestimentos em cerâmica retificada, que aliam estética e durabilidade.
Cozinhas totalmente equipadas com placa vitrocerâmica, forno, micro-ondas, frigorífico, máquina de lavar louça e exaustor, para além de móveis de acabamento luxuoso e tampos em Quartz Compact.
Fachada ventilada revestida a Stacbond, caixilharias em alumínio lacado com vidro duplo, estores elétricos e porta de segurança.
Sistema de aquecimento ambiente e águas sanitárias por bomba de calor, assegurando eficiência energética e conforto durante todo o ano.

A arquitetura do Sul 482 valoriza a luminosidade natural, a amplitude dos espaços e a ligação entre interior e exterior, criando ambientes ideais tanto para o dia a dia como para momentos de lazer.

Viver aqui é estar perto do mar, mas também de restaurantes, escolas, comércio local, ciclovias e toda a dinâmica que faz de Matosinhos Sul uma das zonas mais procuradas e valorizadas da Área Metropolitana do Porto.

O Sul 482 Matosinhos é mais do que um edifício — é um convite a viver com qualidade, sofisticação e proximidade com o que realmente importa.",Diogo Maia,https://i.maxwork.pt/l-feat/listings/12099/7010518/6a85a026-87da-4914-bbf8-68f3271f9877.jpg,https://i.maxwork.pt/ds-l/listings/12099/7010518/da4128ec-015b-40cc-87d5-3fcf604f4dd6.jpg,https://i.maxwork.pt/ds-l/listings/12099/7010518/45635087-0d84-4b67-8702-894d798e899a.jpg,https://i.maxwork.pt/ds-l/listings/12099/7010518/f9934159-8101-4f9d-8748-fd2d98e5be3d.jpg,https://i.maxwork.pt/ds-l/listings/12099/7010518/10a3905e-4543-47bc-bffc-3f7002830eb6.jpg,https://i.maxwork.pt/ds-l/listings/12099/7010518/c0ddc534-8a4b-487b-9459-feab7de253ce.jpg,https://i.maxwork.pt/ds-l/listings/12099/7010518/babd96e4-a282-44e6-96b8-ba0347bf335e.jpg,https://i.maxwork.pt/ds-l/listings/12099/7010518/10ad754c-bde2-4269-8b6b-55e9f52419b0.jpg,https://i.maxwork.pt/ds-l/listings/12099/7010518/eee620cd-b6cc-448c-99ee-2029332c2895.jpg,https://i.maxwork.pt/ds-l/listings/12099/7010518/edfc43d3-0143-4241-a751-9bcb0aad79ff.jpg,,,,,,,,,,,,,,,
2025-12-20 03:07:29,Successful,https://dashboard.browse.ai/workspaces/miguel-pinto/robots/bc1be172-8182-411a-a043-eb327d30c661/history/019b39b9-a7ce-7daf-bd83-2aab2aa5a52b,https://remax.pt/pt/imoveis/venda-apartamento-t3-cascais-carcavelos-e-parede/120992654-480,Apartamento T3 em Cascais com 112 m²,Carcavelos e Parede,399 000 €,Venda,id. 120992654-480,112 m²,3 Quartos,2 WC,E,"Apartamento T3 | São Miguel das Encostas

Este apartamento T3, localizado na Avenida São Miguel das Encostas, distingue-se pela sua área de 112 m² e pelas duas casas de banho, garantindo conforto e praticidade para famílias que procuram espaço e qualidade de vida.

Localização privilegiada

Inserido numa zona residencial tranquila de Carcavelos, este imóvel beneficia da proximidade de vários pontos de interesse: a apenas 5 minutos de carro da Praia de Carcavelos, um dos destinos mais emblemáticos da linha de Cascais, e próximo do campus da Universidade NOVA SBE, referência internacional de ensino superior.

Para conveniência do dia a dia, encontra-se a apenas 10 minutos do Oeiras Parque, além de estar rodeado de comércio local, supermercados e serviços. Destaca-se ainda a proximidade a escolas de excelência como o Colégio Maristas de Carcavelos e o St. Julian’s School.

Acessibilidades e transportes

Com paragens de autocarro a curta distância e a Estação de Carcavelos facilmente acessível, garante ligações rápidas a Lisboa e Cascais. De carro, o acesso imediato à A5 e à Marginal (EN6) assegura mobilidade prática tanto para trabalho como lazer.

Qualidade de vida

Este T3 combina a tranquilidade de um bairro residencial com a conveniência de ter praia, ensino de referência, espaços verdes e centros comerciais a poucos minutos. Uma oportunidade ideal para quem procura conforto e funcionalidade sem abdicar da proximidade ao mar e a todas as comodidades urbanas.",Diogo Maia,https://i.maxwork.pt/l-feat/listings/12099/7011415/cc0d7797-71c7-4135-b0ea-dc218921c12b.jpg,https://i.maxwork.pt/ds-l/listings/12099/7011415/08b9f1c5-4a19-49b4-80e4-bf7f93370052.jpg,https://i.maxwork.pt/ds-l/listings/12099/7011415/77dc71c9-7698-419c-92fc-05526ea794fc.jpg,https://i.maxwork.pt/ds-l/listings/12099/7011415/f9783e39-4e17-4a2a-957e-6705c8c468c3.jpg,https://i.maxwork.pt/ds-l/listings/12099/7011415/eb887f99-471b-4e8b-84bf-b8360416606c.jpg,https://i.maxwork.pt/ds-l/listings/12099/7011415/33b00406-fe91-4de1-b21e-4d8b237a2061.jpg,https://i.maxwork.pt/ds-l/listings/12099/7011415/2aa29e7b-8100-4c27-99c7-e4583a7e140b.jpg,https://i.maxwork.pt/ds-l/listings/12099/7011415/ff54f87d-5729-4dbc-aeba-1802a0a181df.jpg,https://i.maxwork.pt/ds-l/listings/12099/7011415/c3272af7-76e7-47c4-94bf-5f18c23ef40f.jpg,https://i.maxwork.pt/ds-l/listings/12099/7011415/8eaa19b4-439c-4805-abbc-f2cf99688c77.jpg,https://i.maxwork.pt/ds-l/listings/12099/7011415/5be07d96-8345-42c2-9e6c-6071002488e8.jpg,https://i.maxwork.pt/ds-l/listings/12099/7011415/12cf4b4b-ce69-4dc4-94c4-03e12b323ad8.jpg,https://i.maxwork.pt/ds-l/listings/12099/7011415/b0d3845b-7482-4c77-8af9-b25855f07f0c.jpg,https://i.maxwork.pt/ds-l/listings/12099/7011415/d2b8c86c-ba87-4c81-9fd5-c43e08b5d0cb.jpg,https://i.maxwork.pt/ds-l/listings/12099/7011415/9d5b6806-6731-462a-ae83-5735bf1322a1.jpg,,,,,,,,,,
